Item type;Authors;Title;Journal;Publication year;Volume;Issue;Pages;Publisher;Address;Book title;Proceedings title;Conference location;Date published;ISBN;ISSN;URLs;DOI;Abstract;Keywords;Notes;Series
Conference Paper;Zhang S,Zhao S,Yuan M,Zeng J,Yao J,Lyu MR,King I;Traffic Prediction Based Power Saving in Cellular Networks: A Machine Learning Method;;2017;;;;Association for Computing Machinery;New York, NY, USA;;Proceedings of the 25th ACM SIGSPATIAL International Conference on Advances in Geographic Information Systems;Redondo Beach, CA, USA;2017;9,78145E+12;;"https://doi.org/10.1145/3139958.3140053;http://dx.doi.org/10.1145/3139958.3140053";10.1145/3139958.3140053;In smart cities, green cellular networks play a crucial role to support wireless access for numerous devices anywhere and anytime with efficiency and sustainability. Because base stations (BSes) consume more than 70% of overall cellular network infrastructure energy, saving the power consumption of BSes is the key task to build a green cellular network. Except for low power design of the BS hardware and software, the traffic-driven BS sleeping operation is an economical way to improve existing cellular networks, which can reduce the BS power consumption at low traffic load. However, prior BS sleeping strategies establish on the static temporal characteristics of traffic load, which ignore the fact that network traffic is influenced by many factors such as time, human mobility, holiday, weather, etc. Hence, prior traffic estimation is coarse, and the BS sleeping strategies cannot apply to the changing network traffic. In this paper, we exploit a machine learning method to estimate the BS traffic and propose a BS sleeping strategy based on predicted traffic for power saving in the cellular network. We analyze network traffic in multi-views: temporal influence, spatial influence, and event influence. Then, we propose a multi-view ensemble learning model to predict network traffic load, which learns the traffic in multi-views and combine the results with ensemble. Furthermore, we formulate a BS sleeping strategy based on the predicted traffic load. Finally, we evaluate our traffic prediction algorithm on real cellular network data. The evaluation shows that our traffic prediction algorithm improves about 40% than state-of-the-art machine learning methods. Also, we evaluate the proposed BS sleeping strategy, which yields about 10% more energy savings and less device damage than the competitors in the simulated environment.;Smart City, Green Cellular Network, Network Traffic Prediction, Multi-view Learning, Spatio-Temporal Data Analysis;;SIGSPATIAL '17
Conference Paper;Chang J,Meza J,Ranganathan P,Shah A,Shih R,Bash C;Totally Green: Evaluating and Designing Servers for Lifecycle Environmental Impact;;2012;;;25–36;Association for Computing Machinery;New York, NY, USA;;Proceedings of the Seventeenth International Conference on Architectural Support for Programming Languages and Operating Systems;London, England, UK;2012;9,78145E+12;;"https://doi.org/10.1145/2150976.2150980;http://dx.doi.org/10.1145/2150976.2150980";10.1145/2150976.2150980;The environmental impact of servers and datacenters is an important future challenge. System architects have traditionally focused on operational energy as a proxy for designing green servers, but this ignores important environmental implications from server production (materials, manufacturing, etc.). In contrast, this paper argues for a lifecycle focus on the environmental impact of future server designs, to include both operation and production. We present a new methodology to quantify the total environmental impact of system design decisions. Our approach uses the thermodynamic metric of exergy consumption, adapted and validated for use by system architects. Using this methodology, we evaluate the lifecycle impact of several example system designs with environment-friendly optimizations. Our results show that environmental impact from production can be important (around 20% on current servers and growing) and system design choices can reduce this component (by 30--40%). Our results also highlight several, sometimes unexpected, cross-interactions between the environmental impact of production and operation that further motivate a total lifecycle emphasis for future green server designs.;dematerialization, green computing, lifecycle impact, server architecture, environmental sustainability, datacenter design, exergy, disaggregation;;ASPLOS XVII
Journal Article;Chang J,Meza J,Ranganathan P,Shah A,Shih R,Bash C;Totally Green: Evaluating and Designing Servers for Lifecycle Environmental Impact;SIGARCH Comput. Archit. News;2012;40;1;25–36;Association for Computing Machinery;New York, NY, USA;;;;2012-03;;0163-5964;"https://doi.org/10.1145/2189750.2150980;http://dx.doi.org/10.1145/2189750.2150980";10.1145/2189750.2150980;The environmental impact of servers and datacenters is an important future challenge. System architects have traditionally focused on operational energy as a proxy for designing green servers, but this ignores important environmental implications from server production (materials, manufacturing, etc.). In contrast, this paper argues for a lifecycle focus on the environmental impact of future server designs, to include both operation and production. We present a new methodology to quantify the total environmental impact of system design decisions. Our approach uses the thermodynamic metric of exergy consumption, adapted and validated for use by system architects. Using this methodology, we evaluate the lifecycle impact of several example system designs with environment-friendly optimizations. Our results show that environmental impact from production can be important (around 20% on current servers and growing) and system design choices can reduce this component (by 30--40%). Our results also highlight several, sometimes unexpected, cross-interactions between the environmental impact of production and operation that further motivate a total lifecycle emphasis for future green server designs.;exergy, dematerialization, green computing, disaggregation, lifecycle impact, environmental sustainability, datacenter design, server architecture;;
Journal Article;Chang J,Meza J,Ranganathan P,Shah A,Shih R,Bash C;Totally Green: Evaluating and Designing Servers for Lifecycle Environmental Impact;SIGPLAN Not.;2012;47;4;25–36;Association for Computing Machinery;New York, NY, USA;;;;2012-03;;0362-1340;"https://doi.org/10.1145/2248487.2150980;http://dx.doi.org/10.1145/2248487.2150980";10.1145/2248487.2150980;The environmental impact of servers and datacenters is an important future challenge. System architects have traditionally focused on operational energy as a proxy for designing green servers, but this ignores important environmental implications from server production (materials, manufacturing, etc.). In contrast, this paper argues for a lifecycle focus on the environmental impact of future server designs, to include both operation and production. We present a new methodology to quantify the total environmental impact of system design decisions. Our approach uses the thermodynamic metric of exergy consumption, adapted and validated for use by system architects. Using this methodology, we evaluate the lifecycle impact of several example system designs with environment-friendly optimizations. Our results show that environmental impact from production can be important (around 20% on current servers and growing) and system design choices can reduce this component (by 30--40%). Our results also highlight several, sometimes unexpected, cross-interactions between the environmental impact of production and operation that further motivate a total lifecycle emphasis for future green server designs.;dematerialization, green computing, datacenter design, lifecycle impact, exergy, environmental sustainability, disaggregation, server architecture;;
Journal Article;Qiu K,Jao N,Zhou K,Liu Y,Sampson J,Kandemir MT,Narayanan V;MaxTracker: Continuously Tracking the Maximum Computation Progress for Energy Harvesting ReRAM-Based CNN Accelerators;ACM Trans. Embed. Comput. Syst.;2021;20;5s;;Association for Computing Machinery;New York, NY, USA;;;;2021-09;;1539-9087;"https://doi.org/10.1145/3477009;http://dx.doi.org/10.1145/3477009";10.1145/3477009;There is an ongoing trend to increasingly offload inference tasks, such as CNNs, to edge devices in many IoT scenarios. As energy harvesting is an attractive IoT power source, recent ReRAM-based CNN accelerators have been designed for operation on harvested energy. When addressing the instability problems of harvested energy, prior optimization techniques often assume that the load is fixed, overlooking the close interactions among input power, computational load, and circuit efficiency, or adapt the dynamic load to match the just-in-time incoming power under a simple harvesting architecture with no intermediate energy storage.Targeting a more efficient harvesting architecture equipped with both energy storage and energy delivery modules, this paper is the first effort to target whole system, end-to-end efficiency for an energy harvesting ReRAM-based accelerator. First, we model the relationships among ReRAM load power, DC-DC converter efficiency, and power failure overhead. Then, a maximum computation progress tracking scheme (MaxTracker) is proposed to achieve a joint optimization of the whole system by tuning the load power of the ReRAM-based accelerator. Specifically, MaxTracker accommodates both continuous and intermittent computing schemes and provides dynamic ReRAM load according to harvesting scenarios.We evaluate MaxTracker over four input power scenarios, and the experimental results show average speedups of 38.4%/40.3% (up to 51.3%/84.4%), over a full activation scheme (with energy storage) and order-of-magnitude speedups over the recently proposed (energy storage-less) ResiRCA technique. Furthermore, we also explore MaxTracker in combination with the Capybara reconfigurable capacitor approach to offer more flexible tuners and thus further boost the system performance.;maximum computation progress, CNN, DC-DC efficiency, Energy harvesting, computing schemes, ReRAM crossbar;;
Conference Paper;OuldOuali L,Sabouret N,Rich C;I've Got the Power's Value! A Computational Model to Evaluate the Interlocutor's Behaviors in Collaborative Negotiation: Socially Interactive Agents Track;;2018;;;2245–2246;International Foundation for Autonomous Agents and Multiagent Systems;Richland, SC;;Proceedings of the 17th International Conference on Autonomous Agents and MultiAgent Systems;Stockholm, Sweden;2018;;;;;We present in this paper a simulation-oriented theory of mind model for interpreting behaviors of power during a collaborative negotiation. This model relies on a model of negotiation that allows an agent to express behaviors of power through its strategy of negotiation. Based on the simulation theory, we adapted the decision model of the agent to reason about its interlocutor's behavior. A preliminary evaluation in the context of agent-agent interaction shows that the system correctly predicts the interlocutor's power.;reasoning about other, theory of mind, dominance;;AAMAS '18
Conference Paper;Bui DM,Huh EN,Lee S;Optimizing Power Consumption in Cloud Computing Based on Optimization and Predictive Analysis;;2018;;;;Association for Computing Machinery;New York, NY, USA;;Proceedings of the 12th International Conference on Ubiquitous Information Management and Communication;Langkawi, Malaysia;2018;9,78145E+12;;"https://doi.org/10.1145/3164541.3164608;http://dx.doi.org/10.1145/3164541.3164608";10.1145/3164541.3164608;Due to the budget and the environmental issues, achieving energy efficiency gradually receives a lot of attentions these days. In our previous research, a prediction technique has been developed to improve the monitoring statistics. In this research, by adopting the predictive monitoring information, our new proposal can perform the optimization to solve the energy issue of cloud computing. Actually, the optimization technique, which is convex optimization, is coupled with the proposed prediction method to produce a near-optimal set of hosting physical machines. After that, a corresponding migrating instruction can be created eventually. Based on this instruction, the cloud orchestrator can suitably relocate virtual machines to a designed subset of infrastructure. Subsequently, the idle physical servers can be turned off in an appropriate manner to save the power as well as maintain the system performance. For the purpose of evaluation, an experiment is conducted based on 29-day period of Google traces. By utilizing this evaluation, the proposed approach shows the potential to significantly reduce the power consumption without affecting the quality of services.;Energy Efficiency, Cloud Computing, Predictive Analysis, Convex Optimization, IaaS;;IMCOM '18
Conference Paper;Mair J,Huang Z,Eyers D,Chen Y;Quantifying the Energy Efficiency Challenges of Achieving Exascale Computing;;2015;;;943–950;IEEE Press;Shenzhen, China;;Proceedings of the 15th IEEE/ACM International Symposium on Cluster, Cloud, and Grid Computing;;2015;9,78148E+12;;"https://doi.org/10.1109/CCGrid.2015.130;http://dx.doi.org/10.1109/CCGrid.2015.130";10.1109/CCGrid.2015.130;Power and performance are two potentially opposing objectives in the design of a supercomputer, where increases in performance often come at the cost of increased power consumption and vice versa. The task of simultaneously maximising both objectives is becoming an increasingly prominent challenge in the development of future exascale supercomputers. To gain some perspective on the scale of the challenge, we analyse the power and performance trends for the Top500 and Green500 supercomputer lists. We then present the Pa PW metric, which we use to evaluate the scalability of power efficiency, projecting the development of an exascale system. From this analysis, we found that when both power and performance are considered, the projected date of achieving an exascale system falls far beyond the current target of 2020.;;;CCGRID '15
Conference Paper;Belesaca JD,Avila-Campos P,Vazquez-Rodas A;Artificial Neural Network Performance Evaluation for a Hybrid Power Domain Orthogonal / Non-Orthogonal Multiple Access (OMA / NOMA) System;;2020;;;73–80;Association for Computing Machinery;New York, NY, USA;;Proceedings of the 17th ACM Symposium on Performance Evaluation of Wireless Ad Hoc, Sensor, & Ubiquitous Networks;Alicante, Spain;2020;9,78145E+12;;"https://doi.org/10.1145/3416011.3424760;http://dx.doi.org/10.1145/3416011.3424760";10.1145/3416011.3424760;Next-generation wireless technologies face considerable challenges in terms of providing the required latency and connectivity for new heterogeneous mobile networks. Driven by these problems, this study focuses on increasing user connectivity together with system throughput. For doing so, we propose and evaluate a hybrid machine learning-driven orthogonal/non-orthogonal multiple access (OMA/NOMA) system. In this work, we use an artificial neural network (ANN) to assign an OMA or NOMA access method to each user equipment (UE). As part of this research we also evaluate the accuracy and training time of the three most relevant learning algorithms of ANN (L-M, BFGS, and OSS). The main objective is to increase the sum-rate of the mobile network in the introduced beamforming and mmWave channel environment.Simulation results show up to a $20%$ sum-rate average performance increase of the system using the ANN management in contrast to a random non-ANN managed system. The Leveberg-Marquard (L-M) training algorithm is the best overall algorithm for this proposed application as presents the highest accuracy of around $77%$ despite 37 minutes of training and lower accuracy of $73%$ with approximately 28 seconds of training time.;artificial neural networks ANN, MM-wave channel, BFGS, sum-rate, analog beamforming, OSS, L-M, OMA, NOMA;;PE-WASUN '20
Conference Paper;Colmant M,Kurpicz M,Felber P,Huertas L,Rouvoy R,Sobe A;BitWatts: A Process-Level Power Monitoring Middleware;;2014;;;41–42;Association for Computing Machinery;New York, NY, USA;;Proceedings of the Posters and Demos Session of the 15th International Middleware Conference;Bordeaux, France;2014;9,78145E+12;;"https://doi.org/10.1145/2678508.2678529;http://dx.doi.org/10.1145/2678508.2678529";10.1145/2678508.2678529;Power estimation of software processes provides critical indicators to drive scheduling or power capping heuristics. State-of-the-art power estimation solutions only provide coarse-grained support for power estimation. In this paper, we therefore propose a middleware for assembling and configuring software-defined power meters. Software-defined power meters provide real-time and accurate power estimation of software processes. In particular, our solution automatically learns an application-agnostic power model, which can be used to estimate the power consumption of applications.Our approach, named BitWatts, builds on a distributed actor middleware to collect process usage and infer fine-grained power consumption without imposing any hardware investment (e.g., power meters).;CPU power model, middleware toolkit, power monitoring;;Middleware Posters and Demos '14
Conference Paper;Kurihara S,Fukuda S,Hamanaka S,Oguchi M,Yamaguchi S;Application Power Consumption Estimation Considering Software Dependency in Android;;2017;;;;Association for Computing Machinery;New York, NY, USA;;Proceedings of the 11th International Conference on Ubiquitous Information Management and Communication;Beppu, Japan;2017;9,78145E+12;;"https://doi.org/10.1145/3022227.3022312;http://dx.doi.org/10.1145/3022227.3022312";10.1145/3022227.3022312;Android operating system has become one of the most popular smartphone platforms. One report stated that the most important issue of smartphones was its power consumption. Android has a function with which an application can be invoked in screen-off state without user's operation. Some applications frequently work in screen-off state, heavily and consume battery. For saving power consumption in the state, accurate estimation of power consumption of each application is important. However, estimating power consumption cannot be easily achieved because of its dependency on device. That is, application's power consumption varies on installed application and type of hardware module in the device, which can be called software and hardware dependency, respectively. In this paper, we discuss estimation of power consumption in screen-off state considering software dependency. First, we explain software dependency of power consumption. Second, we propose a method, which takes account of software dependency, for estimating power consumption due to GPS. The proposed method monitors GPS utilization individually. Third, we evaluate our method with a benchmark and practical applications using GPS. We then demonstrate that our method can estimate power consumption of each application and suitably predict consumption after uninstalling an application without uninstallation.;battery-draining application, Android, smartphone, GPS;;IMCOM '17
Conference Paper;Chamberlain R,Hemmeter E,Morley R,White J;Modeling the Power Consumption of Audio Signal Processing Computations Using Customized Numerical Representations;;2003;;;249;IEEE Computer Society;USA;;Proceedings of the 36th Annual Symposium on Simulation;;2003;9,78077E+12;;;;This paper explores the impact that numericalrepresentation has on the power consumption of audiosignal processing applications. The motivation is digitalhearing aids, for which minimizing the powerconsumption is a critical design goal. We investigate twoaspects of this problem. First, we evaluate the validity ofusing signal transition counts to model actual powerconsumption within this problem domain, and second, wecompare the relative power consumption of multiply-accumulateoperations for several customized numericalrepresentations.;audio signal processing, power consumption, numerical representation;;ANSS '03
Conference Paper;McGough AS,Forshaw M;Evaluation of Energy Consumption of Replicated Tasks in a Volunteer Computing Environment;;2018;;;85–90;Association for Computing Machinery;New York, NY, USA;;Companion of the 2018 ACM/SPEC International Conference on Performance Engineering;Berlin, Germany;2018;9,78145E+12;;"https://doi.org/10.1145/3185768.3186313;http://dx.doi.org/10.1145/3185768.3186313";10.1145/3185768.3186313;High Throughput Computing allows workloads of many thousands of tasks to be performed efficiently over many distributed resources and frees the user from the laborious process of managing task deployment, execution and result collection. However, in many cases the High Throughput Computing system is comprised from volunteer computational resources where tasks may be evicted by the owner of the resource. This has two main disadvantages. First, tasks may take longer to run as they may require multiple deployments before finally obtaining enough time on a resource to complete. Second, the wasted computation time will lead to wasted energy. We may be able to reduce the effect of the first disadvantage here by submitting multiple replicas of the task and take the results from the first one to complete. This, though, could lead to a significant increase in energy consumption. Thus we desire to only ever submit the minimum number of replicas required to run the task in the allocated time whilst simultaneously minimising energy. In this work we evaluate the use of fixed replica counts and Reinforcement Learning on the proportion of task which fail to finish in a given time-frame and the energy consumed by the system.;trace-driven, machine learning, energy, simulation;;ICPE '18
Conference Paper;Somavat P,Jadhav S,Namboodiri V;Accounting for the Energy Consumption of Personal Computing Including Portable Devices;;2010;;;141–149;Association for Computing Machinery;New York, NY, USA;;Proceedings of the 1st International Conference on Energy-Efficient Computing and Networking;Passau, Germany;2010;9,78145E+12;;"https://doi.org/10.1145/1791314.1791337;http://dx.doi.org/10.1145/1791314.1791337";10.1145/1791314.1791337;In light of the increased awareness of global energy consumption, questions are also being asked about the contribution of computing equipment. Though studies have documented the share of energy consumption due to these equipment over the years, these have rarely characterized the increasing share contributed by the rapidly growing portable computing segment. The portable computing device segment is widely predicted to be a dominant mode of computing and communication, and accounting for its energy consumption is necessary for energy-efficient computing in the future. This work takes a fresh and updated look at the energy consumption due to computing devices in perspective of global consumption, and pays special attention to the contribution of portable computing devices. We further quantify the impact of energy consumed by the computing sector on the environment, as well as on the electricity cost to an average residential consumer. Finally, based on the results of the study, recommendations targeted at the computer networking community are made.;electricity, environment, portable devices, networking, computing, energy;;e-Energy '10
Journal Article;Miyoshi T,Sugino N;Fine-Grain Compensation Method with Consideration of Trade-Offs between Computation and Data Transfer for Power Consumption;SIGARCH Comput. Archit. News;2007;35;5;39–44;Association for Computing Machinery;New York, NY, USA;;;;2007-12;;0163-5964;"https://doi.org/10.1145/1360464.1360475;http://dx.doi.org/10.1145/1360464.1360475";10.1145/1360464.1360475;Fine-grain parallelizing method with consideration of the number of data transfers for low power consumption is proposed. In the proposed method, power consumption by data transfers between processor elements in a multiprocessor is focused on, and the number of data transfers is reduced.In this paper, a measure based on the relationship between variables in a given program is defined to evaluate the number of data transfers, firstly. And then a proposed compensation method by use of the evaluation of power consumption based on the measure is explained. Finally, the result of applying proposed compensation method implemented on COINS framework to several example programs is shown.;;;
