Item type;Authors;Title;Journal;Publication year;Volume;Issue;Pages;Publisher;Address;Book title;Proceedings title;Conference location;Date published;ISBN;ISSN;URLs;DOI;Abstract;Keywords;Notes;Series
Conference Paper;Gaska B,Gniady C,Surdeanu M;MLStar: Machine Learning in Energy Profile Estimation of Android Apps;;2018;;;216–225;Association for Computing Machinery;New York, NY, USA;;Proceedings of the 15th EAI International Conference on Mobile and Ubiquitous Systems: Computing, Networking and Services;New York, NY, USA;2018;9,78145E+12;;"https://doi.org/10.1145/3286978.3287011;http://dx.doi.org/10.1145/3286978.3287011";10.1145/3286978.3287011;Improving the energy efficiency of smartphones is critical for increasing the utility that they provide to the users. With most mobile operating systems, users are responsible for managing their phone's battery efficiency by utilizing the various settings provided by the operating system, as well as selecting energy-efficient apps. However, current app marketplaces do not provide users with information about app energy efficiency, which makes it challenging for the user to make informed decision when selecting an app. This paper presents a novel machine learning approach to estimate app energy efficiency by utilizing textual information available in the Google Play store such as an app's description, user reviews, as well as system permissions. Our detailed analysis of the resulting system shows that hardware permissions, app description, and user reviews correlate well with energy efficiency ratings. We evaluate five models that represent popular classes of machine learning algorithms in their ability to predict energy efficiency ratings. Finally, we compare our approach to gold truth ratings obtained by the actual energy profiling of the app, demonstrating that the proposed system is able to estimate an app's energy efficiency within less than 1 point on the 1-5 scale provided by the profiler, without requiring any kind of profiling.;energy, mobile, machine learning;;MobiQuitous '18
Journal Article;Ismail L,Materwala H;Computing Server Power Modeling in a Data Center: Survey, Taxonomy, and Performance Evaluation;ACM Comput. Surv.;2020;53;3;;Association for Computing Machinery;New York, NY, USA;;;;2020-06;;0360-0300;"https://doi.org/10.1145/3390605;http://dx.doi.org/10.1145/3390605";10.1145/3390605;Data centers are large-scale, energy-hungry infrastructure serving the increasing computational demands as the world is becoming more connected in smart cities. The emergence of advanced technologies such as cloud-based services, internet of things (IoT), and big data analytics has augmented the growth of global data centers, leading to high energy consumption. This upsurge in energy consumption of the data centers not only incurs the issue of surging high cost (operational and maintenance) but also has an adverse effect on the environment. Dynamic power management in a data center environment requires the cognizance of the correlation between the system and hardware-level performance counters and the power consumption. Power consumption modeling exhibits this correlation and is crucial in designing energy-efficient optimization strategies based on resource utilization. Several works in power modeling are proposed and used in the literature. However, these power models have been evaluated using different benchmarking applications, power-measurement techniques, and error-calculation formulas on different machines. In this work, we present a taxonomy and evaluation of 24 software-based power models using a unified environment, benchmarking applications, power-measurement techniques, and error formulas, with the aim of achieving an objective comparison. We use different server architectures to assess the impact of heterogeneity on the models’ comparison. The performance analysis of these models is elaborated in the article.;green computing, resource utilization, energy-efficiency, Data center, machine learning, server power consumption modeling;;
Conference Paper;Jamali H,Karimi A,Haghighizadeh M;A New Method of Cloud-Based Computation Model for Mobile Devices: Energy Consumption Optimization in Mobile-to-Mobile Computation Offloading;;2018;;;32–37;Association for Computing Machinery;New York, NY, USA;;Proceedings of the 6th International Conference on Communications and Broadband Networking;Singapore, Singapore;2018;9,78145E+12;;"https://doi.org/10.1145/3193092.3193103;http://dx.doi.org/10.1145/3193092.3193103";10.1145/3193092.3193103;Today, cell phones have great important role in everyday lives. They are the most effective and achievable communication and computation devices that necessitate no exact time or location. Fast development of movable calculation created an energetic power to develop a synchronous technology in the markets. Anyhow movable devices are encountering with various challenges concerning available resources such as: battery, storage, bandwidth, security, and mobility. On the other side, limitation of resources in these phones has a great effect on the quality of the services. The most important limitation is the energy consuming that leads us to use the device for calculation, in spite of the accessibility of other sources. The best suggested solutions are getting rid of computation on the cloud and use of portable cloud for computation. But If there was no accessible cloud or an accurace of disconnection with the cloud, cell phones are the best to use. According to a mathematical algorithm based on Lyapunov optimization and regarding the requirement time for suitable program, we will try to introduce a dynamic way which its limitation analysis reveals that offlooding the computation considering the limitation of time leads to a less spending of power and energy resembled the current algorithm.;Energy consuming, Mobile cloud computing, energy minimization, Cloud computing, computation offloading;;ICCBN 2018
Conference Paper;Altamimi ML,Naik K;A Computing Profiling Procedure for Mobile Developers to Estimate Energy Cost;;2015;;;301–305;Association for Computing Machinery;New York, NY, USA;;Proceedings of the 18th ACM International Conference on Modeling, Analysis and Simulation of Wireless and Mobile Systems;Cancun, Mexico;2015;9,78145E+12;;"https://doi.org/10.1145/2811587.2811627;http://dx.doi.org/10.1145/2811587.2811627";10.1145/2811587.2811627;Mobile devices are constrained by the limited capacities of their small batteries. However, profiling the energy consumed in the task execution is crucial to help the developers to build energy efficient applications. Therefore, the major challenge in the profiling approach is to accurately estimating the energy consumed for an application by the hardware components, such as CPU, memory, storage unit, and network interfaces. In this work, we develop and validate hardware and software profiling models and procedures. We profile smartphone CPU, where we consider multi-core CPUs and the impact of Dynamic Voltage and Frequency Scaling mechanism on the power consumption. In addition, we profile smartphone storage unit by taking into account the writing and reading rate to the unit. Moreover, we experimentally validated these profiles on two diverse smartphones with different versions of operating systems. The experimental results reveal that our profiles are able to estimate the application energy accurately.;application energy, power and energy consumption, dynamic voltage and frequency scaling, cpu, multi-core cpu, mobile devices;;MSWiM '15
Conference Paper;Hampau RM,Kaptein M,van Emden R,Rost T,Malavolta I;An Empirical Study on the Performance and Energy Consumption of AI Containerization Strategies for Computer-Vision Tasks on the Edge;;2022;;;50–59;Association for Computing Machinery;New York, NY, USA;;Proceedings of the 26th International Conference on Evaluation and Assessment in Software Engineering;Gothenburg, Sweden;2022;9,78145E+12;;"https://doi.org/10.1145/3530019.3530025;http://dx.doi.org/10.1145/3530019.3530025";10.1145/3530019.3530025;Context. The rise of use cases of AI catered towards the Edge, where devices have limited computation power and storage capabilities, motivates the need for better understating of how AI performs and consumes energy. Goal. The aim of this paper is to empirically assess the impact of three different AI containerization strategies on the energy consumption, execution time, CPU, and memory usage for computer-vision tasks on the Edge. Method. In this paper we conduct an experiment with the used containerization strategy as main factor, with three treatments: ONNX Runtime, WebAssembly, and Docker. The subjects of the experiment are four widely-used computer-vision algorithms. We then orchestrate a series of runs where we deploy the four subjects on different generations of Raspberry Pi devices, with different hardware capabilities. A total of 120 runs (per device) are recorded to gather data on energy, execution time, CPU, and memory. Results. We found a statistically significant difference between the three containerization strategies on all dependent variables. Specifically, WebAssembly proves to be a valuable alternative for devices with reduced disk space and computation power. Conclusions. For computer-vision tasks with limited disk space and RAM memory requirements, developers should prefer WebAssembly for deployment. The (non-dockerized) ONNX Runtime resulted to be the best choice in terms of energy consumption and execution time.;;;EASE '22
Conference Paper;Berkelaar MR,Buurman PH,Jess JA;Computing the Entire Active Area/Power Consumption versus Delay Trade-off Curve for Gate Sizing with a Piecewise Linear Simulator;;1994;;;474–480;IEEE Computer Society Press;Washington, DC, USA;;Proceedings of the 1994 IEEE/ACM International Conference on Computer-Aided Design;San Jose, California, USA;1994;9,7809E+12;;;;The gate sizing problem is the problem of finding load drive capabilities for all gates in a given Boolean network such, that a given delay limit is kept, and the necessary cost in terms of active area usage and/or power consumption is minimal. This paper describes a way to obtain the entire cost versus delay trade-off curve of a combinational logic circuit in an efficient way. Every point on the resulting curve is the global optimum of the corresponding gate sizing problem. The problem is solved by mapping it onto piecewise linear models in such a way, that a piecewise linear (circuit) simulator can do the job. It is shown that this setup is very efficient, and can produce trade-off curves for large circuits (thousands of gates) in a few minutes. Benchmark results for the entire set of MCNC '91 two-level examples are given.;;;ICCAD '94
Conference Paper;Chakraborty I,Chandan V,Vrabie D;A Sequential DNN Based Baseline Energy Prediction Framework with Long Term Error Mitigation;;2019;;;508–515;Association for Computing Machinery;New York, NY, USA;;Proceedings of the Tenth ACM International Conference on Future Energy Systems;Phoenix, AZ, USA;2019;9,78145E+12;;"https://doi.org/10.1145/3307772.3331027;http://dx.doi.org/10.1145/3307772.3331027";10.1145/3307772.3331027;In this paper, we present a novel sequential framework containing two deep network architectures for baseline energy prediction of a building. The proposed framework utilizes convolution layers to extract features from the input data space without changing spatial relations between variables. These features are memorized by tensor train based gated recurrent units for an accurate long-term prediction. We observe that this sequential framework helps to improve long term prediction accuracy, thereby mitigating prediction error accumulation over time. Although architectures comprising the amalgamation of convolution layers and memory cell have shown promising results in domains such as social media analysis, language modeling, video frame prediction, and image recognition, this paper extends its scope to the context of energy applications. Furthermore, the addition of tensor train based gated recurrent units is motivated by the necessity of computational time reduction during the training process, thereby making this framework suitable for field deployment. Results on a commercial building dataset show that the current framework outperforms other existing machine learning based methods, in both short-term and long-term prediction categories.;;;e-Energy '19
Journal Article;Klostermeyer WF,Srinivas K;Reducing Disk Power Consumption in a Portable Computer;SIGOPS Oper. Syst. Rev.;1995;29;2;27–32;Association for Computing Machinery;New York, NY, USA;;;;1995-04;;0163-5980;"https://doi.org/10.1145/202213.202218;http://dx.doi.org/10.1145/202213.202218";10.1145/202213.202218;The problem of minimizing disk power consumption in portable personal computers is studied. Two online algorithms for determining when to stop spinning a disk are presented and analyzed using competitive analysis techniques.;;;
Conference Paper;Hindle A,Wilson A,Rasmussen K,Barlow EJ,Campbell JC,Romansky S;GreenMiner: A Hardware Based Mining Software Repositories Software Energy Consumption Framework;;2014;;;12–21;Association for Computing Machinery;New York, NY, USA;;Proceedings of the 11th Working Conference on Mining Software Repositories;Hyderabad, India;2014;9,78145E+12;;"https://doi.org/10.1145/2597073.2597097;http://dx.doi.org/10.1145/2597073.2597097";10.1145/2597073.2597097;Green Mining is a field of MSR that studies software energy consumption and relies on software performance data. Unfortunately there is a severe lack of publicly available software power use performance data. This means that green mining researchers must generate this data themselves by writing tests, building multiple revisions of a product, and then running these tests multiple times (10+) for each software revision while measuring power use. Then, they must aggregate these measurements to estimate the energy consumed by the tests for each software revision. This is time consuming and is made more difficult by the constraints of mobile devices and their OSes. In this paper we propose, implement, and demonstrate Green Miner: the first dedicated hardware mining software repositories testbed. The Green Miner physically measures the energy consumption of mobile devices (Android phones) and automates the testing of applications, and the reporting of measurements back to developers and researchers. The Green Miner has already produced valuable results for commercial Android application developers, and has been shown to replicate other power studies' results.;Software Change, Software Energy Consumption, Android;;MSR 2014
Conference Paper;Moussa RR,Dewidar KM;Evaluating the Efficiency of Energy-Scape Software;;2019;;;60–65;Association for Computing Machinery;New York, NY, USA;;Proceedings of the 8th International Conference on Software and Information Engineering;Cairo, Egypt;2019;9,78145E+12;;"https://doi.org/10.1145/3328833.3328868;http://dx.doi.org/10.1145/3328833.3328868";10.1145/3328833.3328868;Recently, researchers were focusing on integrating renewable energy (RE) within urban environment instead of integrating renewables with buildings due to the large occupies of urban areas. Urban areas have a great potential in generating sufficient amount of energy that could satisfy the needs of urban neighborhoods. Energy-scape elements are sustainable elements that integrates RE devices with landscape elements. This research focuses on analyzing the importance and efficiency of Energy-scape software through a qualitative method. The efficiency of Energy-scape web-based application will be tested using qualitative method and a site survey. The research concludes that Energy-scape software application is an effective tool for landscape designers in using Energy-scape elements, it identifies the optimum type and location of Energy-scape elements within their projects, and it calculates the impact of using Energy-scape elements in term of energy-savings and carbon emission (CO2) reduction.;Renewable energy, Landscape elements, Energy-scape database, Energy-scape Elements, Energy-scape software;;ICSIE '19
Conference Paper;van Gastel B;Analysing Energy Consumption of Systems Controlled by Software;;2017;;;;Association for Computing Machinery;New York, NY, USA;;Companion Proceedings of the 1st International Conference on the Art, Science, and Engineering of Programming;Brussels, Belgium;2017;9,78145E+12;;"https://doi.org/10.1145/3079368.3079396;http://dx.doi.org/10.1145/3079368.3079396";10.1145/3079368.3079396;Energy consumption analysis of IT-controlled systems can play a major role in minimising the overall energy consumption of such IT systems, during the development phase, or for optimisation in the field. As software is increasingly embedded in our daily life, with IT using more and more energy, the software industry should become aware of their energy footprint, and methods must be developed to assist in reducing this footprint.Recently, we developed a precise energy analysis, to analyse software in conjunction with hardware. It has the property of being parametric with regard to the hardware. In principle, this creates the opportunity to investigate which is the best software implementation for given hardware, or the other way around: choose the best hardware for a given algorithm.;;;Programming '17
Journal Article;Ha TM,Samejima M,Komoda N;Power and Performance Estimation for Fine-Grained Server Power Capping via Controlling Heterogeneous Applications;ACM Trans. Manage. Inf. Syst.;2017;8;4;;Association for Computing Machinery;New York, NY, USA;;;;2017-08;;2158-656X;"https://doi.org/10.1145/3086449;http://dx.doi.org/10.1145/3086449";10.1145/3086449;Power capping is a method to save power consumption of servers by limiting performance of the servers. Although users frequently run applications on different virtual machines (VMs) for keeping their performance and having them isolated from the other applications, power capping may degrade performance of all the applications running on the server. We present fine-grained power capping by limiting performance of each application individually. For keeping performance defined in Quality of Service (QoS) requirements, it is important to estimate applications’ performance and power consumption after the fine-grained power capping is applied. We propose the estimation method of physical CPU usage when limiting virtual CPU usage of applications on VMs. On servers where multiple VMs run, VM’s usage of physical CPU is interrupted by the other VMs, and a hypervisor uses physical CPU to control VMs. These VMs’ and hypervisor’s behaviors make it difficult to estimate performance and power consumption by straightforward methods, such as linear regression and polynomial regression. The proposed method uses Piecewise Linear Regression to estimate physical CPU usage by assuming that VM’s access to physical CPU is not interrupted by the other VMs. Then we estimate how much physical CPU usage is reduced by the interruption. Because physical CPU usage is not stable soon after limiting CPU usage, the proposed method estimates a convergence value of CPU usage after many interruptions are repeated.;piecewise linear regression, Server power capping, response time, power consumption;;
Conference Paper;Rieger F,Bockisch C;Survey of Approaches for Assessing Software Energy Consumption;;2017;;;19–24;Association for Computing Machinery;New York, NY, USA;;Proceedings of the 2nd ACM SIGPLAN International Workshop on Comprehension of Complex Systems;Vancouver, BC, Canada;2017;9,78145E+12;;"https://doi.org/10.1145/3141842.3141846;http://dx.doi.org/10.1145/3141842.3141846";10.1145/3141842.3141846;Though the energy consumption of software-controlled ICT systems ranging from mobile devices to data centers is increasingly gaining attention, energy optimization is still far from an established task in the software development process. Therefore, we have surveyed the available research on assessing the energy consumption of software systems, which showed a lack of development tools, but several approaches exist for measuring the energy consumption. We group these approaches according to how measurement data is made available and compare several characteristics of the collected data. The survey shows that not only development tools for software energy optimization are still missing, but there is also a lack of fine-grained measurement approaches as well as approaches for general-purpose platforms.;Survey, Software Energy Behavior, Energy Analysis, Energy Measurement;;CoCoS 2017
Conference Paper;Noureddine A,Rouvoy R,Seinturier L;Unit Testing of Energy Consumption of Software Libraries;;2014;;;1200–1205;Association for Computing Machinery;New York, NY, USA;;Proceedings of the 29th Annual ACM Symposium on Applied Computing;Gyeongju, Republic of Korea;2014;9,78145E+12;;"https://doi.org/10.1145/2554850.2554932;http://dx.doi.org/10.1145/2554850.2554932";10.1145/2554850.2554932;The development of energy-efficient software has become a key requirement for a large number of devices, from smartphones to data centers. However, measuring accurately this consumption is a major challenge that state-of-the-art approaches have tried to tackle with a limited success. While monitoring applications' consumption offers a clear insight on where the energy is being spent, it does not help in understanding how the energy is consumed. In this paper, we therefore introduce JalenUnit, a software framework that infers the energy consumption model of software libraries from execution traces. This model can then be used to diagnose application code for detecting energy bugs, understanding energy distribution, establishing energy profiles and classifications, and comparing software libraries against their energy consumption.;energy measurement, software metrics, empirical benchmarking, energy, modeling, benchmarks, power modeling;;SAC '14
Conference Paper;Jagroep E,Broekman J,van der Werf JM,Brinkkemper S,Lago P,Blom L,van Vliet R;Awakening Awareness on Energy Consumption in Software Engineering;;2017;;;76–85;IEEE Press;Buenos Aires, Argentina;;Proceedings of the 39th International Conference on Software Engineering: Software Engineering in Society Track;;2017;9,78154E+12;;"https://doi.org/10.1109/ICSE-SEIS.2017.10;http://dx.doi.org/10.1109/ICSE-SEIS.2017.10";10.1109/ICSE-SEIS.2017.10;Software producing organizations have the ability to address the energy impact of their ICT solutions during the development process. However, while industry is convinced of the energy impact of hardware, the role of software has mostly been acknowledged by researchers in software engineering. Strengthened by the limited practical knowledge to reduce the energy consumption, organizations have less control over the energy impact of their products and lose the contribution of software towards energy related strategies. Consequently, industry risks not being able to meet customer requirements or even fulfill corporate sustainability goals.In this paper we perform an exploratory case study on how to create and maintain awareness on an energy consumption perspective for software among stakeholders involved with the development of software products. During the study, we followed the development process of two commercial software products and provided direct feedback to the stakeholders on the effects of their development efforts, specifically concerning energy consumption and performance, using an energy dashboard. Multiple awareness measurements allowed us to keep track of changes over time on specific aspects affecting software development. Our results show that, despite a mixed sentiment towards the dashboard, changed awareness has triggered discussion on the energy consumption of software.;software engineering, energy consumption perspective, software energy consumption, awareness;;ICSE-SEIS '17
Conference Paper;Ournani Z,Rouvoy R,Rust P,Penhoat J;On Reducing the Energy Consumption of Software: From Hurdles to Requirements;;2020;;;;Association for Computing Machinery;New York, NY, USA;;Proceedings of the 14th ACM / IEEE International Symposium on Empirical Software Engineering and Measurement (ESEM);Bari, Italy;2020;9,78145E+12;;"https://doi.org/10.1145/3382494.3410678;http://dx.doi.org/10.1145/3382494.3410678";10.1145/3382494.3410678;Background. As software took control over hardware in many domains, the question of the energy footprint induced by the software is becoming critical for our society, as the resources powering the underlying infrastructure are finite. Yet, beyond this growing interest, energy consumption remains a difficult concept to master for a developer.Aims. The purpose of this study is to better understand the root causes that prevent the issue of software energy consumption to be more widely considered by developers and companies.Method. To investigate this issue, this paper reports on a qualitative study we conducted in an industrial context. We applied an in-depth analysis of the interviews of 10 experienced developers and summarized a set of implications.Results. We argue that our study delivers i) insightful feedback on how green software design is considered among the interviewed developers and ii) a set of findings to build helpful tools, motivate further research, and establish better development strategies to promote green software design.Conclusion. This paper covers an industrial case study of developers' awareness of green software design and how to promote it within the company. While it might not be generalizable for any company, we believe our results deliver a common body of knowledge with implications to be considered for similar cases and further researches.;;;ESEM '20
