Item type;Authors;Title;Journal;Publication year;Volume;Issue;Pages;Publisher;Address;Book title;Proceedings title;Conference location;Date published;ISBN;ISSN;URLs;DOI;Abstract;Keywords;Notes;Series
Conference Paper;Farkas KI,Flinn J,Back G,Grunwald D,Anderson JM;Quantifying the Energy Consumption of a Pocket Computer and a Java Virtual Machine;;2000;;;252–263;Association for Computing Machinery;New York, NY, USA;;Proceedings of the 2000 ACM SIGMETRICS International Conference on Measurement and Modeling of Computer Systems;Santa Clara, California, USA;2000;9,78158E+12;;"https://doi.org/10.1145/339331.339421;http://dx.doi.org/10.1145/339331.339421";10.1145/339331.339421;In this paper, we examine the energy consumption of a state-of-the-art pocket computer. Using a data acquisition system, we measure the energy consumption of the Itsy Pocket Computer, developed by Compaq Computer Corporation's Palo Alto Research Labs. We begin by showing that the energy usage characteristics of the Itsy differ markedly from that of a notebook computer. Then, since we expect that flexible software environments will become increasingly prevalent on pocket computers, we consider applications running in a Java environment. In particular, we explain some of the Java design tradeoffs applicable to pocket computers, and quantify their energy costs. For the design options we considered and the three workloads we studied, we find a maximum change in energy use of 25%.;;;SIGMETRICS '00
Journal Article;Farkas KI,Flinn J,Back G,Grunwald D,Anderson JM;Quantifying the Energy Consumption of a Pocket Computer and a Java Virtual Machine;SIGMETRICS Perform. Eval. Rev.;2000;28;1;252–263;Association for Computing Machinery;New York, NY, USA;;;;2000-06;;0163-5999;"https://doi.org/10.1145/345063.339421;http://dx.doi.org/10.1145/345063.339421";10.1145/345063.339421;In this paper, we examine the energy consumption of a state-of-the-art pocket computer. Using a data acquisition system, we measure the energy consumption of the Itsy Pocket Computer, developed by Compaq Computer Corporation's Palo Alto Research Labs. We begin by showing that the energy usage characteristics of the Itsy differ markedly from that of a notebook computer. Then, since we expect that flexible software environments will become increasingly prevalent on pocket computers, we consider applications running in a Java environment. In particular, we explain some of the Java design tradeoffs applicable to pocket computers, and quantify their energy costs. For the design options we considered and the three workloads we studied, we find a maximum change in energy use of 25%.;;;
Conference Paper;Gao Y,Yan D,Liu N,Luo S,Zhou Z,Wang Y,Chen Y,Gao B;A High-Frequency Monitoring Method for Urban Carbon Emissions Based on Vertical Federated Deep Learning and Multi-Source Heterogeneous Data Fusion Methods;;2023;;;232–237;Association for Computing Machinery;New York, NY, USA;;Proceedings of the 5th International Conference on Information Technologies and Electrical Engineering;Changsha, China;2023;9,78145E+12;;"https://doi.org/10.1145/3582935.3582972;http://dx.doi.org/10.1145/3582935.3582972";10.1145/3582935.3582972;Carbon emissions are the main culprit of global warming. Accurate carbon emission forecasting helps government departments formulate effective carbon emission reduction policies and helps the carbon emission market develop orderly. Implementing an accurate and effective carbon emission monitoring model requires the collaboration of many parties because carbon emission-related data involves many sectors and industries. However, for the relevant characteristics of carbon emission monitoring, due to the different collection and storage standards of various departments, poor maintenance environment, lack of data, data loss, and abnormal severe, resulting in high frequency and high precision carbon emission monitoring. As privacy protection and data security issues are gradually taken seriously by government departments and related enterprises, the inability or unwillingness to share carbon emission-related data among enterprises or even among various departments within enterprises has created an increasingly severe data silo phenomenon. In addition, how effectively breaking the data barriers between various sectors is an urgent problem in grasping carbon emission change changes accurately. Therefore, this paper proposes a carbon emission monitoring model for key urban sectors based on vertical federated deep learning and multi-source heterogeneous data fusion and sharing. The experimental results show that the model accurately predicts carbon emission change trends in various application scenarios under the data availability and invisibility of each participant.;Carbon Emissions Monitoring, Vertical Federated Deep Learning, Privacy and security protection, Multi-source heterogeneous data fusion;;ICITEE '22
Conference Paper;Jun L,Jie Z,DingHong P;Cloud Computing Virtual Machine Migration Energy Measuring Research;;2020;;;;Association for Computing Machinery;New York, NY, USA;;Proceedings of the 3rd International Conference on Vision, Image and Signal Processing;Vancouver, BC, Canada;2020;9,78145E+12;;"https://doi.org/10.1145/3387168.3387192;http://dx.doi.org/10.1145/3387168.3387192";10.1145/3387168.3387192;This paper research virtual machine migration energy measuring on IPv4/IPv6 network based on cloud computing infrastructure platform, it conducts a research on the energy measuring in IPv4/IPv6 cloud computing platform, and presents a dynamic energy measuring mathematical model based on analyzing CPU energy consumption changes brought by random assignment works. The research determines mathematical model parameter values and it completes the IPv4/IPv6 cloud computing platform virtual machine migration experimentally. This paper achieves the energy consumption of IPv4/IPv6 transition prior-period, mid-period and last-period cloud computing platform virtual machine migration, the conclusions in line with the cloud energy measurement needs, it builds the theoretical foundation for cloud computing platform energy consumption optimize.;Virtual Machine Migration, Energy Measuring, Cloud Computing, Migration Energy Consumption;;ICVISP 2019
Conference Paper;Pathania P,Mehra R,Sharma VS,Kaulgud V,Podder S,Burden AP;ESAVE: Estimating Server and Virtual Machine Energy;;2023;;;;Association for Computing Machinery;New York, NY, USA;;Proceedings of the 37th IEEE/ACM International Conference on Automated Software Engineering;Rochester, MI, USA;2023;9,78145E+12;;"https://doi.org/10.1145/3551349.3561170;http://dx.doi.org/10.1145/3551349.3561170";10.1145/3551349.3561170;Sustainable software engineering has received a lot of attention in recent times, as we witness an ever-growing slice of energy use, for example, at data centers, as software systems utilize the underlying infrastructure. Characterizing servers for their energy use accurately without being intrusive, is therefore important to make sustainable software deployment choices. In this paper, we introduce ESAVE which is a machine learning-based approach that leverages a small set of hardware attributes to characterize a server or virtual machine’s energy usage across different levels of utilization. This is based upon an extensive exploration of multiple ML approaches, with a focus on a minimal set of required attributes, while showcasing good accuracy. Early validations show that ESAVE has only around 12% average prediction error, despite being non-intrusive.;;;ASE '22
Conference Paper;Huynh HT,Quan HD;Energy Expenditure Estimation Based on Artificial Intelligence and Microservice Architecture;;2020;;;159–163;Association for Computing Machinery;New York, NY, USA;;Proceedings of the 4th International Conference on Machine Learning and Soft Computing;Haiphong City, Viet Nam;2020;9,78145E+12;;"https://doi.org/10.1145/3380688.3380715;http://dx.doi.org/10.1145/3380688.3380715";10.1145/3380688.3380715;"Nutritional status plays an important role in not only pregnancy outcomes but also neonatal health. One of efficient techniques to control the nutritional status is to estimate the energy expenditure. There are some approaches for estimating energy expenditure. However, they have limitations including high cost, relative complexity, trained personnel requirements, or locality. This study investigates in a system for data collection and analysis (IoH-Internet of Health) developing based on microservice architecture, and its application for energy expenditure estimation. The proposed system has a good ability to scale and integrate with other systems; the energy expenditure estimation is performed by using artificial intelligence. The experimental results have shown the promising results of the proposed system.";IoH system, data collection, expenditure energy estimation, healthcare, visualization;;ICMLSC '20
Journal Article;Alavani G,Desai J,Saha S,Sarkar S;Program Analysis and Machine Learning Based Approach to Predict Power Consumption of CUDA Kernel;ACM Trans. Model. Perform. Eval. Comput. Syst.;2023;;;;Association for Computing Machinery;New York, NY, USA;;;;2023-06;;2376-3639;"https://doi.org/10.1145/3603533;http://dx.doi.org/10.1145/3603533";10.1145/3603533;General Purpose Graphics Processing Unit (GPGPU) has secured a prominent position in the High-Performance Computing (HPC) world due to its performance gain and programmability. Understanding the relationship between GPU power consumption and program features can aid developers in building energy-efficient sustainable applications. In this work, we propose a static analysis based power model built using machine learning techniques. We have investigated six machine learning models across three NVIDIA GPU architectures: Kepler, Maxwell, and Volta with Random Forest, Extra Trees, Gradient Boosting, CatBoost, and XGBoost, reporting favorable results. We observed that the XGBoost technique based prediction model is the most efficient technique with an R-square value of 0.9646 on Volta Architecture. The dataset used for these techniques includes kernels from different benchmarks suits, sizes, nature (e.g., compute-bound, memory-bound), and complexity (e.g., control divergence, memory access patterns). Experimental results suggest that the proposed solution can help developers precisely predict GPU applications power consumption using program analysis across GPU architectures. Developers can use this approach to refactor their code to build energy-efficient GPU applications.;"GPGPU Computing ; XGBoost ; CatBoost ; CUDA; Static Analysis ; Sustainable Computing";Just Accepted;
Conference Paper;Colmant M,Kurpicz M,Felber P,Huertas L,Rouvoy R,Sobe A;Process-Level Power Estimation in VM-Based Systems;;2015;;;;Association for Computing Machinery;New York, NY, USA;;Proceedings of the Tenth European Conference on Computer Systems;Bordeaux, France;2015;9,78145E+12;;"https://doi.org/10.1145/2741948.2741971;http://dx.doi.org/10.1145/2741948.2741971";10.1145/2741948.2741971;Power estimation of software processes provides critical indicators to drive scheduling or power capping heuristics. State-of-the-art solutions can perform coarse-grained power estimation in virtualized environments, typically treating virtual machines (VMs) as a black box. Yet, VM-based systems are nowadays commonly used to host multiple applications for cost savings and better use of energy by sharing common resources and assets.In this paper, we propose a fine-grained monitoring middleware providing real-time and accurate power estimation of software processes running at any level of virtualization in a system. In particular, our solution automatically learns an application-agnostic power model, which can be used to estimate the power consumption of applications.Our middleware implementation, named BitWatts, builds on a distributed actor implementation to collect process usage and infer fine-grained power consumption without imposing any hardware investment (e.g., power meters). BitWatts instances use high-throughput communication channels to spread the power consumption across the VM levels and between machines. Our experiments, based on CPU- and memory-intensive benchmarks running on different hardware setups, demonstrate that BitWatts scales both in number of monitored processes and virtualization levels. This non-invasive monitoring solution therefore paves the way for scalable energy accounting that takes into account the dynamic nature of virtualized environments.;;;EuroSys '15
Conference Paper;Hinz M,Miers CC,Pillon MA,Koslovski GP;A Cost Model for IaaS Clouds Based on Virtual Machine Energy Consumption;;2016;;;136–143;Brazilian Computer Society;Porto Alegre, BRA;;Proceedings of the XII Brazilian Symposium on Information Systems on Brazilian Symposium on Information Systems: Information Systems in the Cloud Computing Era - Volume 1;Florianopolis, Santa Catarina, Brazil;2016;9,78858E+12;;;;Reduction in data center energy consumption is a constant motivation for IaaS providers. Among all components, CPU appears as a main energy consumer. Although there is a strong relationship between CPU load and its energy consumption, pricing models of popular IaaS providers do not consider this information as a primary and variable element. This paper quantifies the relationship by identifying the individual consumption of virtual CPUs, which form the basis for an allocation cost model. The proposed model, termed Virtual Power, is faced with Amazon EC2 pricing model pointing a cost reduction for IaaS provider and a proportional sharing between users.;IaaS, Cost, Virtual Machine, Model;;SBSI 2016
Conference Paper;Lu Y,Wei D;Chaos Prediction of Power Systems by Using Deep Learning;;2022;;;11–17;Association for Computing Machinery;New York, NY, USA;;2022 14th International Conference on Machine Learning and Computing (ICMLC);Guangzhou, China;2022;9,78145E+12;;"https://doi.org/10.1145/3529836.3529843;http://dx.doi.org/10.1145/3529836.3529843";10.1145/3529836.3529843;Ensuring the stability of power systems is an important issue that should be considered in order to ensure the social and economic development of a country. Therefore, predicting the chaotic behavior of power systems in order to develop protection measures and keep power systems stable is vital. In this paper, a deep learning algorithm was proposed to predict the chaotic behavior of power systems by using deep long short-term memory (DLSTM) networks, which have two forms: deep long short-term memory with static scenario (DLSTM-s) and deep long-term memory with dynamic scenario (DLSTM-d). The genetic algorithm was used to optimize the hyperparameters of the networks. Then, taking interconnected power systems as an example, the effectiveness of the proposed DLSTM network was verified via numerical simulation. Finally, the experimental results of the DLSTM network were compared with those of the echo state network, multi-recurrent neural network, deep gated recurrent unit, and long short-term memory. Experimental results illustrated that a trained DLSTM network can predict the chaotic behavior of power systems by using the time series data of a single state variable. Moreover, the DLSTM-s network proposed in this paper can achieve competitive prediction performance compared with other baseline methods.;Chaos prediction, Deep learning, Deep long short-term memory, Power system;;ICMLC 2022
Journal Article;Dong X,Chen Y,Chen J,Wang Y,Li J,Ni T,Shi Z,Yin X,Zhuo C;Worst-Case Power Integrity Prediction Using Convolutional Neural Network;ACM Trans. Des. Autom. Electron. Syst.;2023;28;4;;Association for Computing Machinery;New York, NY, USA;;;;2023-05;;1084-4309;"https://doi.org/10.1145/3564932;http://dx.doi.org/10.1145/3564932";10.1145/3564932;Power integrity analysis is an essential step in power distribution network (PDN) sign-off to ensure the performance and reliability of chips. However, with the growing PDN size and increasing scenarios to be validated, it becomes very time- and resource-consuming to conduct full-stack PDN simulation to check the power integrity for different test vectors. Recently, various works have proposed machine learning–based methods for PDN power integrity prediction, many of which still suffer from large training overhead, inefficiency, or non-scalability. Thus, this article proposed an efficient and scalable framework for the worst-case power integrity prediction, which can handle general tasks including dynamic noise prediction and bump current prediction. The framework first reduces the spatial and temporal redundancy in the PDN and input current vector and then employs efficient feature extraction as well as a novel convolutional neural network architecture to predict the worst-case power integrity. Experimental results show that the proposed framework consistently outperforms the commercial tool and the state-of-the-art machine learning method with only 0.63–1.02% mean relative error and 25–69× speedup for noise prediction and 0.22–1.06% mean relative error and 24–64× speedup for bump current prediction.;convolutional neural network, Power distribution network, sign-off, power integrity, dynamic noise validation, bump current prediction;;
Journal Article;Henderson P,Hu J,Romoff J,Brunskill E,Jurafsky D,Pineau J;Towards the Systematic Reporting of the Energy and Carbon Footprints of Machine Learning;J. Mach. Learn. Res.;2020;21;1;;JMLR.org;;;;;2020-01;;1532-4435;;;Accurate reporting of energy and carbon usage is essential for understanding the potential climate impacts of machine learning research. We introduce a framework that makes this easier by providing a simple interface for tracking realtime energy consumption and carbon emissions, as well as generating standardized online appendices. Utilizing this framework, we create a leaderboard for energy efficient reinforcement learning algorithms to incentivize responsible research in this area as an example for other areas of machine learning. Finally, based on case studies using our framework, we propose strategies for mitigation of carbon emissions and reduction of energy consumption. By making accounting easier, we hope to further the sustainable development of machine learning experiments and spur more research into energy efficient algorithms.;climate change, deep learning, green computing, reinforcement learning, energy efficiency;;
Conference Paper;Dutta B,Adhinarayanan V,Feng WC;GPU Power Prediction via Ensemble Machine Learning for DVFS Space Exploration;;2018;;;240–243;Association for Computing Machinery;New York, NY, USA;;Proceedings of the 15th ACM International Conference on Computing Frontiers;Ischia, Italy;2018;9,78145E+12;;"https://doi.org/10.1145/3203217.3203273;http://dx.doi.org/10.1145/3203217.3203273";10.1145/3203217.3203273;A software-based approach to achieve high performance within a power budget often involves dynamic voltage and frequency scaling (DVFS). Thus, accurately predicting the power consumption of an application at different DVFS levels (or more generally, different processor configurations) is paramount for the energy-efficient functioning of a high-performance computing (HPC) system. The increasing prevalence of graphics processing units (GPUs) in HPC systems presents new challenges in power management, and machine learning presents an unique way to improve the software-based power management of these systems. As such, we explore the problem of GPU power prediction at different DVFS states via machine learning. Specifically, we propose a new ensemble technique that incorporates three machine-learning techniques --- sequential minimal optimization regression, simple linear regression, and decision tree --- to reduce the mean absolute error (MAE) to 3.5%.;;;CF '18
Conference Paper;Jeyasurya B;Power System Voltage Instability Monitoring with Artificial Neural Networks;;1994;;;57–62;Gordon and Breach Science Publishers, Inc.;USA;;Proceedings of the 7th International Conference on Industrial and Engineering Applications of Artificial Intelligence and Expert Systems;Austin, Texas, USA;1994;9,78288E+12;;;;;;;IEA/AIE '94
Conference Paper;Zhang B,Han J,Ren Y,Wen H,Song Z,Gan Q,Wei R,Dang X,Zhou B;An Online Power System Dynamics Prediction Based on Deep Neural Network;;2018;;;39–43;Association for Computing Machinery;New York, NY, USA;;Proceedings of the 2018 International Conference on Electronics and Electrical Engineering Technology;Tianjin, China;2018;9,78145E+12;;"https://doi.org/10.1145/3277453.3277464;http://dx.doi.org/10.1145/3277453.3277464";10.1145/3277453.3277464;Building Power analysis has drawn more and more attention in recent years. In this paper, we present a system for online power prediction for the public building. It is based on a 4-layers Deep Neural Network that use architectural metrics of the physical machines collected dynamically by our system to predict the physical machine power consumption. A real implementation of our system shows that the prediction accuracy could reach 76.50%.;Deep computer architecture, Energy management, Deep neural networks;;EEET '18
Conference Paper;Ciftcioglu E,Ricos M;Efficient Power Adaptation against Deep Learning Based Predictive Adversaries;;2019;;;37–42;Association for Computing Machinery;New York, NY, USA;;Proceedings of the ACM Workshop on Wireless Security and Machine Learning;Miami, FL, USA;2019;9,78145E+12;;"https://doi.org/10.1145/3324921.3328787;http://dx.doi.org/10.1145/3324921.3328787";10.1145/3324921.3328787;Wireless communication networks are subject to various types of adversarial attacks, which might be passive in the form of eavesdropping, or active in the form of jamming. For the former category, even if the traffic is encrypted, an adversary performing analysis on observed traffic signatures may lead to leakage of the so called contextual information regarding the traffic. New advances in the field of machine learning also result in significantly more complex adversarial units, which may deduce different forms and uses of such contextual information. In this work, we are interested in power adaptation against an intelligent adversary which utilizes deep learning and attempts to perform predictions and time forecasting on the observed traffic traces to estimate the imminent traffic intensities. Based on its traffic predictions, the adversary might possibly activate its jamming mode and utilize its limited power more efficiently to inflict maximal damage. As a method of mitigation, the transmitter may want to increase transmitter power if it expects a higher probability of jamming, and it has a significant amount of upcoming data to transmit. We leverage Lyapunov optimization and virtual queues to meet a certain level of data transmission reliability while also minimizing power consumption.;power control, wireless security, recurrent neural networks;;WiseML 2019
Conference Paper;Shanti N,Assi A,Shakhshir H,Salman A;Machine Learning-Powered Mobile App for Predicting Used Car Prices;;2022;;;52–60;Association for Computing Machinery;New York, NY, USA;;Proceedings of the 2021 3rd International Conference on Big-Data Service and Intelligent Computation;Xiamen, China;2022;9,78145E+12;;"https://doi.org/10.1145/3502300.3502307;http://dx.doi.org/10.1145/3502300.3502307";10.1145/3502300.3502307;Buying and selling used cars is a common practice in all countries. When looking to sell a car, the seller decides the price of their car after monitoring the prices of similar cars in the advertisements. When someone is looking to buy a car, they watch advertisements for similar cars to get an idea of the price of the car they want to purchase. Despite the availability of blue books that provide an estimate of automotive pricing, real market prices vary depending on demand and supply. In this paper, we applied cutting-edge machine learning techniques to automate this process. The training data set is up-to-date and it was collected from an active commercial website. We created semi-automated rule-based scripts to clean and prepare the data for machine learning. Several machine learning algorithms were explored to generate an approximate value for the car pricing, including Artificial Neural Network, Support Vector Machine, K-Nearest Neighbors, Random Forest, and Gradient Boosted Decision Tree. To determine the features that most affect the price, extensive data analysis and cleaning were undertaken. Our findings indicate that the testing accuracy is 90%. Finally, a mobile application was created that provides an estimated price of a given car's properties, guiding a user in determining the price of their car. The complete code and the data used to obtain these results can be accessed on GitHub at [1] [19].;mobile application,  Car price Prediction, Regression, Machine learning;;BDSIC '21
