,title,link,abstract,authors,keywords,date,isbn,doi,pub_info,title_lower,keep_title,bib,result_id,article,publisher,journal_or_book,count,data_source
1889,A Comparative Analysis of the Computation Cost and Energy Consumption of Relevant Curves of ECC Presented in Literature,https://www.ijecer.org/ijecer/article/view/318,,,,,,,"M Elhajj, P Mulder - International Journal of Electrical and Computer …, 2023 - ijecer.org",a comparative analysis of the computation cost and energy consumption of relevant curves of ecc presented in literature,1,0,s22Xn1oXExcJ,,,,2,scholar
1977,Energy consumption estimation of software components based on program flowcharts,https://ieeexplore.ieee.org/abstract/document/7056795/,,,,,,,"P Heinrich, H Bergler, D Eilers - … Conf on Embedded Software …, 2014 - ieeexplore.ieee.org",energy consumption estimation of software components based on program flowcharts,1,0,hJaHd6ZLyDMJ,,,,1,scholar
2012,A Retargetable Software Power Estimation Methodology,https://link.springer.com/chapter/10.1007/978-1-4757-3281-8_21,,,,,,,"C Brandolese - System-on-Chip Methodologies & Design Languages, 2001 - Springer",a retargetable software power estimation methodology,1,0,u6wABZm4Ux4J,,,,1,scholar
2047,Estimation of Power Consumption of Each Application Considering Software Dependency in Android,https://cir.nii.ac.jp/crid/1050564287863194368,,,,,,,"K Shun, F Shoki, K Takeshi, F Akira, O Masato… - 情報処理学会論文誌 …, 2019 - cir.nii.ac.jp",estimation of power consumption of each application considering software dependency in android,1,0,92GJEZH-0ccJ,,,,2,scholar
2086,Inferring parametric energy consumption functions at different software levels: ISA vs. LLVM IR,https://link.springer.com/chapter/10.1007/978-3-319-46559-3_5,,,,,,,"U Liqat, K Georgiou, S Kerrison, P Lopez-Garcia… - … and Practical Aspects of …, 2016 - Springer",inferring parametric energy consumption functions at different software levels isa vs llvm ir,1,0,WwAjooHz6f0J,,,,1,scholar
2147,"Assessing sustainability of software: analysing correctness, memory and energy consumption.: Analysing correctness, memory and energy consumption",https://research.ou.nl/en/publications/assessing-sustainability-of-software-analysing-correctness-memory,,,,,,,BE van Gastel - 2016 - research.ou.nl,assessing sustainability of software analysing correctness memory and energy consumption analysing correctness memory and energy consumption,1,0,tzuu48UEaUUJ,,,,1,scholar
2189,Modeling and visualizing networked multi-core embedded software energy consumption,https://arxiv.org/abs/1509.02830,,,,,,,"S Kerrison, K Eder - arXiv preprint arXiv:1509.02830, 2015 - arxiv.org",modeling and visualizing networked multi core embedded software energy consumption,1,0,-1iB-vE13hQJ,,,,1,scholar
2195,Reducing Memory-Bus Energy Consumption of GPUs via Software-Based Bit-Flip Minimization,https://ieeexplore.ieee.org/abstract/document/10024054/,,,,,,,"A Fallin, M Burtscher - 2022 IEEE/ACM Workshop on Memory …, 2022 - ieeexplore.ieee.org",reducing memory bus energy consumption of gpus via software based bit flip minimization,1,0,cyZGFL4wwiQJ,,,,1,scholar
2197,Cost and Power Consumption Joint Optimization Based Virtual Network Embedding Algorithm for Software-Defined Networking,https://www.ejournal.org.cn/EN/10.12263/DZXB.20190688,,,,,,,"R CHAI, D XIE, Q CHEN - ACTA ELECTONICA SINICA, 2021 - ejournal.org.cn",cost and power consumption joint optimization based virtual network embedding algorithm for software defined networking,1,0,0lLKDnez6L4J,,,,1,scholar
2211,Management Software Power Consumption During Operation Objects of Technocenological Type,https://link.springer.com/chapter/10.1007/978-3-031-24820-7_13,,,,,,,"V Gnatyuk, O Kivchun, A Kovalev… - Energy Ecosystems …, 2023 - Springer",management software power consumption during operation objects of technocenological type,1,0,LeoAwsDWklkJ,,,,1,scholar
2219,Towards Power Consumption Optimization for Embedded Systems from a Model-driven Software Development Perspective,https://link.springer.com/chapter/10.1007/978-3-031-11513-4_6,,,,,,,"M Schaarschmidt, M Uelschen… - Software Technologies …, 2022 - Springer",towards power consumption optimization for embedded systems from a model driven software development perspective,1,0,DrZnD5jwbeAJ,,,,1,scholar
2228,Measurement System for Energy Consumption of Runtime Software in Embedded System,https://link.springer.com/chapter/10.1007/978-981-19-4109-2_13,,,,,,,"W Liu, Y Ni, X Du, WB Li, L Chen, Z Zeng… - International Symposium …, 2021 - Springer",measurement system for energy consumption of runtime software in embedded system,1,0,AgggUP5KgUEJ,,,,1,scholar
2240,Analyzing the energy consumption of mobile antivirus software,https://www.academia.edu/download/45105437/paper.pdf,,,,,,,"I Polakis, M Diamantaris, T Petsas, F Maggi… - Detection of Intrusions …, 2015 - academia.edu",analyzing the energy consumption of mobile antivirus software,1,0,29k0pqccBLAJ,,,,1,scholar
2246,Does maintainability relate to the energy consumption of software?,https://ruidera.uclm.es/xmlui/handle/10578/27404,,,,,,,"C Calero, J Mancebo Pavón, F García - 2021 - ruidera.uclm.es",does maintainability relate to the energy consumption of software,1,0,Vpk8RVraO84J,,,,1,scholar
2250,Hardware/Software Partitioning Algorithm under Multi-Constraints for the Optimization of Power Consumption,https://www.degruyter.com/document/doi/10.1515/9783110584998/pdf#page=600,,,,,,,"J Zhang, D Zhou, X Qiu, R Lai - Current Trends in Computer Science …, 2018 - degruyter.com",hardware software partitioning algorithm under multi constraints for the optimization of power consumption,1,0,-UmPJ19WgHkJ,,,,1,scholar
2269,Energy consumption prediction in software-defined wirelwss sensor networks.,https://www.teses.usp.br/teses/disponiveis/3/3141/tde-04052018-113551/en.php,,,,,,,"N Segura, G Alonso - teses.usp.br",energy consumption prediction in software defined wirelwss sensor networks,1,0,xd2y1lHVOZAJ,,,,1,scholar
2279,Consumption Management Software for Electric Power Suppliers,https://www.dbjournal.ro/archive/31/31_SPI.pdf#page=32,,,,,,,OBTÖR CIOBANU - DATABASE SYSTEMS - dbjournal.ro,consumption management software for electric power suppliers,1,0,JprGnaIz3f0J,,,,2,scholar
2283,Necessary conditions for creating web-based software for monitoring energy consumption,https://essuir.sumdu.edu.ua/handle/123456789/46839,,,,,,,"AV Maslivets, AL Perekrest - 2016 - essuir.sumdu.edu.ua",necessary conditions for creating web based software for monitoring energy consumption,1,0,PPdiEFAPisoJ,,,,1,scholar
2302,Balancing power consumption and reliability in the embedded systems software design,https://ieeexplore.ieee.org/abstract/document/5606368/,,,,,,,"F Vargas, CA Rocha, B Pianta - 2010 Argentine School of …, 2010 - ieeexplore.ieee.org",balancing power consumption and reliability in the embedded systems software design,1,0,uJhm_03ec6YJ,,,,1,scholar
2381,Computer software program for monitoring the availability of systems and components of electric power generating systems,https://inis.iaea.org/search/search.aspx?orig_q=RN:26006788,,,,,,,"TA Petersen, TA Hilsmeier, DM Kapinus - American power conference …, 1994 - inis.iaea.org",computer software program for monitoring the availability of systems and components of electric power generating systems,1,0,-Gvw1_-uthoJ,,,,1,scholar
2408,Simple Estimation Model and Energy-efficient Virtual Machine Migration Algorithm in a Server Cluster,https://cir.nii.ac.jp/crid/1390853649755100416,,,,,,,"R WATANABE - 法政大学大学院紀要. 理工学・工学研究科編, 2019 - cir.nii.ac.jp",simple estimation model and energy efficient virtual machine migration algorithm in a server cluster,1,0,FhmiOWuvbsUJ,,,,1,scholar
2433,Minimizing power consumption with performance efficiency constraint in web server clusters,https://ieeexplore.ieee.org/abstract/document/5350201/,,,,,,,"Y Yang, N Xiong, A Aikebaier… - … on Network-Based …, 2009 - ieeexplore.ieee.org",minimizing power consumption with performance efficiency constraint in web server clusters,1,0,FBiswcJaR5IJ,,,,1,scholar
2458,Effect of energy-saving server scheduling on power consumption for large-scale data centers,https://www.aimsciences.org/article/doi/10.3934/jimo.2016.12.667,,,,,,,"M Kato, H Masuyama, S Kasahara… - Journal of Industrial …, 2015 - aimsciences.org",effect of energy saving server scheduling on power consumption for large scale data centers,1,0,LCQfNBa8c7IJ,,,,1,scholar
2486,On Minimizing RTOS Aperiodic Tasks Server Energy Consumption,https://ieeexplore.ieee.org/abstract/document/4538772/,,,,,,,"K Dudacek - 2008 11th IEEE Workshop on Design and …, 2008 - ieeexplore.ieee.org",on minimizing rtos aperiodic tasks server energy consumption,1,0,B9aezD2475gJ,,,,1,scholar
2531,Power consumption-aware virtual machine placement in cloud data center,https://ieeexplore.ieee.org/abstract/document/7973189/,,,,,,,"G Portaluri, D Adami, A Gabbrielli… - IEEE Transactions …, 2017 - ieeexplore.ieee.org",power consumption aware virtual machine placement in cloud data center,1,0,xExVWGxVz0AJ,,,,1,scholar
2549,Bayes Theorem Based Virtual Machine Scheduling for Optimal Energy Consumption.,https://cdn.techscience.cn/ueditor/files/csse/TSP_CSSE-43-1/TSP_CSSE_23706/TSP_CSSE_23706.pdf,,,,,,,"R Swathy, B Vinayagasundaram - Computer Systems Science & …, 2022 - cdn.techscience.cn",bayes theorem based virtual machine scheduling for optimal energy consumption,1,0,GQtafjSmfpIJ,,,,1,scholar
2551,Retraction Note: Energy consumption analysis of Virtual Machine migration in cloud using hybrid swarm optimization (ABC–BA),https://link.springer.com/article/10.1007/s11227-022-04860-2,,,,,,,"K Karthikeyan, R Sunder, K Shankar… - 2023 - Springer",retraction note energy consumption analysis of virtual machine migration in cloud using hybrid swarm optimization abc ba,1,0,2psvaGXpfgEJ,,,,1,scholar
2576,Scheduling algorithms for federated learning with minimal energy consumption,https://ieeexplore.ieee.org/abstract/document/10032558/,,,,,,,"LL Pilla - IEEE Transactions on Parallel and Distributed …, 2023 - ieeexplore.ieee.org",scheduling algorithms for federated learning with minimal energy consumption,1,0,6_MYrun_6ngJ,,,,2,scholar
