page_number,position,result_type,title,link,result_id,publication_info_summary,snippet,cited_by_count,cited_by_link,cited_by_id,total_versions,all_versions_link,all_versions_id,file_format,file_title,file_link
4,11,,Estimation of Power System Transient Stability by Artificial Neural Network Taking Account of Energy Functions,https://www.jstage.jst.go.jp/article/ieejeiss1987/121/2/121_2_430/_article/-char/ja/,ZbBZ-Rwl7GIJ,"H Yamada, Y Li, K Yukita, Y Goto, K Mizuno… - IEEJ Transactions on …, 2001 - jstage.jst.go.jp","… is demanded in the power system operation. In this paper, the neural network technique is applied … A suitable topology for the neural network is developed, and the appropriate training …",1.0,"https://scholar.google.com/scholar?cites=7128113116593369189&as_sdt=2005&sciodt=0,5&hl=en&num=20",7128113116593369189,,{},{},PDF,jst.go.jp,https://www.jstage.jst.go.jp/article/ieejeiss1987/121/2/121_2_430/_pdf
4,12,,BP Neural Network Model for Seam Tracking Offset during High-Power Fiber Laser Welding,https://www.scientific.net/AMR.418-420.1464,2iqx5dVhYhkJ,"L Mo, XD Gao, Q Wen, DY You - Advanced Materials Research, 2012 - Trans Tech Publ","… to the seam tracking offset during high power fiber laser welding … Finally, we utilized the eignvalues of seam tracking offset, … BP neural network model to monitor the seam tracking status. …",1.0,"https://scholar.google.com/scholar?cites=1829131969975364314&as_sdt=2005&sciodt=0,5&hl=en&num=20",1829131969975364314,,{},{},,,
4,13,,Maximum Power Tracking Control Of Self Excited Induction Generator By Using Artificial Neural Network,https://ieeexplore.ieee.org/abstract/document/9726089/,FbkI0k4EEfkJ,"SRK Reddy, JBV Subrahmanyam… - … for Advancement in …, 2022 - ieeexplore.ieee.org","… An Artificial Neural Network (ANN) method to MPT is described in detail in this article. To regulate the DC-DC boost converter, the suggested method uses an artificial neural network (…",,{},{},,{},{},,,
4,14,,Research on Maximum Power Point Tracking Based on LSTM Neural Network,https://ieeexplore.ieee.org/abstract/document/9513198/,QAILuIh16oAJ,"S Pengcheng, Q Jiawei - 2021 4th International Conference on …, 2021 - ieeexplore.ieee.org","… a research hotspot in the field of new energy. In actual scenarios, the working environment … LSTM recurrent neural network and attention mechanism for maximum power point tracking, …",,{},{},2.0,"https://scholar.google.com/scholar?cluster=9289366411468800576&hl=en&num=20&as_sdt=0,5&as_vis=1",9289366411468800576,,,
4,15,,Obtaining a Neural Network Mathematical Model That Takes Into Account Various Power Supply Schemes,https://www.shs-conferences.org/articles/shsconf/abs/2021/04/shsconf_nid2020_01019/shsconf_nid2020_01019.html,GfnAkTsIEJgJ,"GA Kilin, BV Kavalerov, AI Suslov… - SHS Web of …, 2021 - shs-conferences.org","… neural network, we can simulate not only most modes of operation of a power system, but also various schemes of such a power … neural network mathematical model of a power system, …",1.0,"https://scholar.google.com/scholar?cites=10957266945333852441&as_sdt=2005&sciodt=0,5&hl=en&num=20",10957266945333852441,2.0,"https://scholar.google.com/scholar?cluster=10957266945333852441&hl=en&num=20&as_sdt=0,5&as_vis=1",10957266945333852441,PDF,shs-conferences.org,https://www.shs-conferences.org/articles/shsconf/pdf/2021/04/shsconf_nid2020_01019.pdf
4,16,,Neural Network Based Maximum Power Point Tracking Scheme for PV System Under Partially Shaded Conditions,https://link.springer.com/chapter/10.1007/978-981-33-6606-0_46,ThbuaYgkXcsJ,"L Chenghao, L Henghao, S Jiacheng… - The Proceedings of the …, 2021 - Springer","… In this paper, a new neural network based MPPT … of tracking and accuracy under PSCs. As it was shown, ANN method tracked the GMPPs quickly within 0.2 s, and the output power was …",,{},{},2.0,"https://scholar.google.com/scholar?cluster=14653908930844825166&hl=en&num=20&as_sdt=0,5&as_vis=1",14653908930844825166,,,
4,17,Pdf,Design of Artificial Neural Network based Maximum Power Point Tracking Considering Indore Region Data of 2019-2020,https://scholar.archive.org/work/t3mr54kt7vh4foctqmdwbwy7n4/access/wayback/http://ijdieret.in/Upload/June%202021%20Vol%2010%20No%201/June%202021%20Vol%2010%20No%201_JJ_2102.pdf,ijEtjNH3YvcJ,"P Saxena, N Khatri - 2021 - scholar.archive.org",… energy is one of the mostly used renewable energy and it is definitely a great solution as there are innovative ways to transfer energy … In this paper artificial neural network based MPPT …,,{},{},,{},{},PDF,archive.org,https://scholar.archive.org/work/t3mr54kt7vh4foctqmdwbwy7n4/access/wayback/http://ijdieret.in/Upload/June%202021%20Vol%2010%20No%201/June%202021%20Vol%2010%20No%201_JJ_2102.pdf
4,18,,Neural network maximum power point tracking control algorithm for fast-changing conditions on Mars' surface,https://www.politesi.polimi.it/handle/10589/185895,tb653O_22IEJ,M Burigana - 2022 - politesi.polimi.it,"… in the solar power generation field rises in order to improve performance. In particular, this thesis focuses on proving the feasibility of exploiting a neural network controller for solar …",,{},{},,{},{},PDF,polimi.it,https://www.politesi.polimi.it/bitstream/10589/185895/1/Thesis_burigana_marzio.pdf
4,19,,Maximum Power Point Tracking (MPPT) for a PV System Based on Artificial Neural Network ANN and Comparison with P&O Algorithm,https://link.springer.com/chapter/10.1007/978-981-15-6403-1_45,tq7ljgjIzqgJ,"A Djalab, N Sabri, A Teta - Proceedings of the 4th International Conference …, 2021 - Springer",… deliver its maximum power regardless of the … neural network (ANN) maximum power point tracking (MPPT) method which is fast and precise in finding and tracking the maximum power …,,{},{},,{},{},,,
4,20,Pdf,Enhancing the Power Tracking Method in Hybrid System using Artificial Neural Network Integrated with Fuzzy Controller,https://sciresol.s3.us-east-2.amazonaws.com/IJST/Articles/2019/Issue-17/Article11.pdf,rP9LbOylCuAJ,"J Karthika, M Rajkumar… - Indian Journal …, 2019 - sciresol.s3.us-east-2.amazonaws …","… Due to fast tracking of maximum power, the overall efficiency is highly … tracking of maximum power in hybrid system. Application: This controller can be used in all renewable energy …",,{},{},,{},{},PDF,amazonaws.com,https://sciresol.s3.us-east-2.amazonaws.com/IJST/Articles/2019/Issue-17/Article11.pdf
5,1,Pdf,… of Conventional Maximum Power Point Tracking Algorithm with Artificial Neural Network Based Maximum Power Point Tracking Algorithm with Respect to …,https://www.researchgate.net/profile/Navita-Khatri/publication/352678381_Comparison_of_Conventional_Maximum_Power_Point_Tracking_Algorithm_with_Artificial_Neural_Network_Based_Maximum_Power_Point_Tracking_Algorithm_with_Respect_to_Change_in_Load/links/62fde2f9ceb9764f7204745e/Comparison-of-Conventional-Maximum-Power-Point-Tracking-Algorithm-with-Artificial-Neural-Network-Based-Maximum-Power-Point-Tracking-Algorithm-with-Respect-to-Change-in-Load.pdf,zUwCMpjBj8EJ,"P Saxena, N Khatri - Journal of Control System and its Recent …, 2021 - researchgate.net",… intensify the output power of the Solar Photovoltaic. In this paper artificial neural network based maximum power point tracking algorithm is proposed to enhance the power output of the …,,{},{},2.0,"https://scholar.google.com/scholar?cluster=13947579430407916749&hl=en&num=20&as_sdt=0,5&as_vis=1",13947579430407916749,PDF,researchgate.net,https://www.researchgate.net/profile/Navita-Khatri/publication/352678381_Comparison_of_Conventional_Maximum_Power_Point_Tracking_Algorithm_with_Artificial_Neural_Network_Based_Maximum_Power_Point_Tracking_Algorithm_with_Respect_to_Change_in_Load/links/62fde2f9ceb9764f7204745e/Comparison-of-Conventional-Maximum-Power-Point-Tracking-Algorithm-with-Artificial-Neural-Network-Based-Maximum-Power-Point-Tracking-Algorithm-with-Respect-to-Change-in-Load.pdf
5,2,Html,Rigdelet Neural Networks-based Maximum Power Point Tracking for a PEMFC connected to the network with Interleaved Boost Converter optimized by …,https://www.sciencedirect.com/science/article/pii/S2352484723003773,v2B2Tr3fBywJ,"Y Su, K Ma, S Zheng, D Xue, X Li - Energy Reports, 2023 - Elsevier","… This data is injected into the Rigdelet Neural Network controller to get Maximum Power Point. To establish efficient results of the proposed network, it has been updated based on the …",1.0,"https://scholar.google.com/scholar?cites=3172750466663997631&as_sdt=2005&sciodt=0,5&hl=en&num=20",3172750466663997631,,{},{},HTML,sciencedirect.com,https://www.sciencedirect.com/science/article/pii/S2352484723003773
5,3,Pdf,Investigation of Different Designs of Artificial Neural Network for Maximum Power Point Tracking of Grid Connected PV System,https://ijsret.com/wp-content/uploads/2019/05/IJSRET_V5_issue3_293.pdf,8ujx2cTkJxcJ,MN Ali - 2019 - ijsret.com,… Abstract-This paper aims at increasing the PV system efficiency through the design of the Artificial Neural Network (ANN) for maximum power point tracking (MPPT) of grid connected PV …,,{},{},2.0,"https://scholar.google.com/scholar?cluster=1668553721085290738&hl=en&num=20&as_sdt=0,5&as_vis=1",1668553721085290738,PDF,ijsret.com,https://ijsret.com/wp-content/uploads/2019/05/IJSRET_V5_issue3_293.pdf
5,4,,"Development of neural network controllers for power industry applications. Volume 1, Final report",https://www.osti.gov/biblio/205958,VRnJiA6DrdgJ,"B Widrow, R Shen, F Beaufays, E Wan, E Plumer… - 1995 - osti.gov","… report details an investigation in the development of the theory of the design of neural network controllers, and their application to power … of the training of neural network controllers in …",,{},{},2.0,"https://scholar.google.com/scholar?cluster=15613279581611039061&hl=en&num=20&as_sdt=0,5&as_vis=1",15613279581611039061,,,
5,5,,Experimental evaluation of neural network based real time maximum power tracking controller for PV system; Neural network wo mochiita taiyoko hatsuden system no …,https://www.osti.gov/etdeweb/biblio/123956,KkEtfQtT3vEJ,"T Hiyama, S Kozuma, T Imakubo - … Engineers of Japan. Power and Energy), 1995 - osti.gov",… power tracking control for a photovoltaic (PV) power … computer system using a neural network. The evaluation requires … possible by having the neural network learn the relationship …,,{},{},,{},{},,,
5,6,,"Neural network recognition of nuclear power plant transients. Final report, April 15, 1992--April 15, 1995",https://inis.iaea.org/search/search.aspx?orig_q=RN:27031878,Ib5Q8hldXK0J,EB Bartlett - 1995 - inis.iaea.org,"… This report was prepared as an account of work sponsored by the United States Government. Neither the United States nor the Department of Energy, nor any of their employees, nor …",,{},{},2.0,"https://scholar.google.com/scholar?cluster=12491961832439856673&hl=en&num=20&as_sdt=0,5&as_vis=1",12491961832439856673,PDF,iaea.org,https://inis.iaea.org/collection/NCLCollectionStore/_Public/27/031/27031878.pdf
5,7,,Experimental Evaluation of Neural Network Based Real Time Maximum Power Tracking Controller for PV System,https://www.jstage.jst.go.jp/article/ieejpes1990/115/7/115_7_698/_article/-char/ja/,iGTPf7Tq08kJ,"T Hiyama, S Kouzuma, T Imakubo - … on Power and Energy, 1995 - jstage.jst.go.jp",… This paper presents a neural network based real time maximum power tracking controller … (PV) systems to commercial power sources through inverters. The neural network is utilized to …,,{},{},2.0,"https://scholar.google.com/scholar?cluster=14543225682668774536&hl=en&num=20&as_sdt=0,5&as_vis=1",14543225682668774536,PDF,jst.go.jp,https://www.jstage.jst.go.jp/article/ieejpes1990/115/7/115_7_698/_pdf
5,8,,A Novel Frequency Tracking Method Based on Complex Adaptive Linear Neural Network State Vector in Power Systems,https://books.google.com/books?hl=en&lr=&id=YM2gDwAAQBAJ&oi=fnd&pg=PA259&dq=(%22neural+network%22)+%2B+(tracking%7Creport%7Creports%7Creporting%7Caccount)+%2B+(energy%7Cpower%7C%22environmental+impact%22%7C%22carbon+footprint%22%7C%22carbon+emissions%22%7C%22carbon+impact%22)+-wind+-building+-buildings+-vehicles+-homes+-ships+-solar+-photovoltaic+-vehicle&ots=vrJBUoLlmK&sig=pZ4QhT9emtuOckNTbjdaAXgAqHU,iLmrxE8zodwJ,"M Joorabian, I Sadinejad… - … NEURAL NETWORKS ͳ …, 2011 - books.google.com",… A frequency tracking method based on linear estimation of phase (LEP) has been … adaptive linear neural network (CADALINE) in tracking the fundamental power system frequency. In …,,{},{},7.0,"https://scholar.google.com/scholar?cluster=15898044577289582984&hl=en&num=20&as_sdt=0,5&as_vis=1",15898044577289582984,PDF,researchgate.net,https://www.researchgate.net/profile/Kenji-Suzuki-2/publication/319316523_Artificial_Neural_Networks_-_Industrial_and_Control_Engineering_Applications/links/59a430100f7e9b4f7df368d3/Artificial-Neural-Networks-Industrial-and-Control-Engineering-Applications.pdf#page=271
5,9,,TRACKING PARTICLES IN A HIGH ENERGY PARTICLE DETECTOR USING A NEURAL GAS NETWORK,https://www.sciencedirect.com/science/article/pii/B9780444894885500762,FLa4_HW_QRcJ,"M Goldstein - Artificial Neural Networks, 1992 - Elsevier","… Finding tracks of particles, with a self-organizing neural network, from particle detector signals, is discussed. The neural network has been trained using Monte Carlo simulated events …",,{},{},2.0,"https://scholar.google.com/scholar?cluster=1675831049830577684&hl=en&num=20&as_sdt=0,5&as_vis=1",1675831049830577684,,,
5,10,,PENGATURAN MAXIMUM POWER POINT TRACKING (MPPT) MENGGUNAKAN ARTIFICIAL NEURAL NETWORK (ANN) BERBASIS SIMULASI,https://jurnal.unsyiah.ac.id/kitektro/article/view/25006,44V4X-vFyqYJ,"MF Rozi, S Syukiryadin, S Suriadi - Jurnal Komputer, Informasi …, 2022 - jurnal.unsyiah.ac.id",… Artificial Neural Network (ANN) Artificial Neural Network atau jaringan saraf tiruan adalah jaringan dari sekelompok unit jaringan saraf manusia. ANN merupakan sistem adaptif yang …,,{},{},2.0,"https://scholar.google.com/scholar?cluster=12018636170301310435&hl=en&num=20&as_sdt=0,5&as_vis=1",12018636170301310435,PDF,unsyiah.ac.id,https://jurnal.unsyiah.ac.id/kitektro/article/download/25006/16557
5,11,Pdf,Maximum Output Power Tracking Pada Pembangkit Listrik Tenaga Angin Stand Alone Berbasis Neural Network Counterpropagation-Fuzzy Logic Controller,https://www.researchgate.net/profile/Muldi-Yuhendri/publication/327602123_Maximum_Output_Power_Tracking_pada_Pembangkit_Listrik_Tenaga_Angin_Stand_Alone_Berbasis_Neural_Network_Counterpropagation-Fuzzy_Logic_Controller/links/5b9b358b299bf13e602d48dd/Maximum-Output-Power-Tracking-pada-Pembangkit-Listrik-Tenaga-Angin-Stand-Alone-Berbasis-Neural-Network-Counterpropagation-Fuzzy-Logic-Controller.pdf,CkltU1MSFjoJ,"M Yuhendri, M Ashari, MH Purnomo - Proceedings of CITEE, 2009 - researchgate.net","… power generation system to produce the maximum output power, which is based on a Neural Network … of the wind velocity to extract the maximum power. A FLC is used for control a …",1.0,"https://scholar.google.com/scholar?cites=4185553052778711306&as_sdt=2005&sciodt=0,5&hl=en&num=20",4185553052778711306,2.0,"https://scholar.google.com/scholar?cluster=4185553052778711306&hl=en&num=20&as_sdt=0,5&as_vis=1",4185553052778711306,PDF,researchgate.net,https://www.researchgate.net/profile/Muldi-Yuhendri/publication/327602123_Maximum_Output_Power_Tracking_pada_Pembangkit_Listrik_Tenaga_Angin_Stand_Alone_Berbasis_Neural_Network_Counterpropagation-Fuzzy_Logic_Controller/links/5b9b358b299bf13e602d48dd/Maximum-Output-Power-Tracking-pada-Pembangkit-Listrik-Tenaga-Angin-Stand-Alone-Berbasis-Neural-Network-Counterpropagation-Fuzzy-Logic-Controller.pdf
5,12,,… POINT TRACKING (MPPT) PADA SISTEM PLTS DI DESA GUMENO MENGGUNAKAN ZETA KONVERTER BERBASIS ALGORITMA ARTIFICIAL NEURAL NETWORK …,https://eprints.umm.ac.id/94937/,JL85U7hE1N8J,SA Dinata - 2022 - eprints.umm.ac.id,"In the use of Solar Power Generation systems, getting maximum power on the photovoltaic is very important. This study proposes the use of the Maximum Power Point Tracking (MPPT) …",,{},{},,{},{},PDF,umm.ac.id,https://eprints.umm.ac.id/94937/48/PENDAHULUAN.pdf
