page_number,position,result_type,title,link,result_id,publication_info_summary,snippet,cited_by_count,cited_by_link,cited_by_id,total_versions,all_versions_link,all_versions_id,file_format,file_title,file_link
1,1,,Virtual machine power measuring technique with bounded error in cloud environments,https://www.sciencedirect.com/science/article/pii/S1084804512002494,rcQk6XzjosIJ,"P Xiao, Z Hu, D Liu, G Yan, X Qu - Journal of Network and Computer …, 2013 - Elsevier","… To avoid using empirical coefficients to construct VM power model, we introduce the conception of relative PMC for measuring the per-VM power consumption. Based on the conception …",46.0,"https://scholar.google.com/scholar?cites=14025022315212096685&as_sdt=2005&sciodt=0,5&hl=en&num=20",14025022315212096685,5.0,"https://scholar.google.com/scholar?cluster=14025022315212096685&hl=en&num=20&as_sdt=0,5&as_vis=1",14025022315212096685,,,
1,2,,Performance Analysis of a Dynamic Virtual Machine Management Method Based on the Power-Aware Integral Estimation,https://www.mdpi.com/1324504,olLLTyz4AD8J,"E Zharikov, S Telenyk - Electronics, 2021 - mdpi.com","… virtual machine (VM) consolidation allows for effectively managing the physical resources of cloud data centers. However, a tremendous waste of power … a problem of power-aware VM …",1.0,"https://scholar.google.com/scholar?cites=4539901293590434466&as_sdt=2005&sciodt=0,5&hl=en&num=20",4539901293590434466,3.0,"https://scholar.google.com/scholar?cluster=4539901293590434466&hl=en&num=20&as_sdt=0,5&as_vis=1",4539901293590434466,HTML,mdpi.com,https://www.mdpi.com/2079-9292/10/21/2581/htm
1,3,Pdf,A low-cost power measuring technique for virtual machine in cloud environments,https://www.academia.edu/download/35772478/A_Low_Cost_Power_Measuring_Technique_for_Virtual_Machine.pdf,Q2r38LUFwxMJ,"X Peng, Z Sai - Int. J. Grid Distrib. Comput, 2013 - academia.edu","… the goal of energy conservation, accurately measuring the power … Conventional power models can only provide fine-grained power … In this paper, we proposed a novel power measuring …",11.0,"https://scholar.google.com/scholar?cites=1423988186169174595&as_sdt=2005&sciodt=0,5&hl=en&num=20",1423988186169174595,4.0,"https://scholar.google.com/scholar?cluster=1423988186169174595&hl=en&num=20&as_sdt=0,5&as_vis=1",1423988186169174595,PDF,academia.edu,https://www.academia.edu/download/35772478/A_Low_Cost_Power_Measuring_Technique_for_Virtual_Machine.pdf
1,4,,Cloud Computing Virtual Machine Migration Energy Measuring Research,https://dl.acm.org/doi/abs/10.1145/3387168.3387192,EQJayB2vxiYJ,"L Jun, Z Jie, P DingHong - … of the 3rd International Conference on Vision …, 2019 - dl.acm.org","… in running time integral to calculate energy consumption [9], to lay … virtual machine migration energy optimization. This study aims to calculate the energy consumption of virtual machine …",1.0,"https://scholar.google.com/scholar?cites=2794113161280225809&as_sdt=2005&sciodt=0,5&hl=en&num=20",2794113161280225809,,{},{},,,
1,5,,Simple Estimation Model and Energy-efficient Virtual Machine Migration Algorithm in a Server Cluster,https://cir.nii.ac.jp/crid/1390853649755100416,FhmiOWuvbsUJ,"R WATANABE - 法政大学大学院紀要. 理工学・工学研究科編, 2019 - cir.nii.ac.jp","… In this thesis, we propose a virtual machine migration approach to reducing the electric energy consumption of servers. In our previous algorithms, one virtual machine migrates from a …",,{},{},,{},{},,,
