page_number,position,result_type,title,link,result_id,publication_info_summary,snippet,cited_by_count,cited_by_link,cited_by_id,total_versions,all_versions_link,all_versions_id,file_format,file_title,file_link
1,1,,Ai for science: Report on the department of energy (doe) town halls on artificial intelligence (ai) for science,https://www.osti.gov/biblio/1604756,Gzj04_zI65wJ,"R Stevens, V Taylor, J Nichols, AB Maccabe, K Yelick… - 2020 - osti.gov","… report and in the Department of Energy (DOE) laboratory community, we use the term “AI for … computing, including the development and application of AI methods (eg, machine learning, …",79.0,"https://scholar.google.com/scholar?cites=11307352277925509147&as_sdt=5,48&sciodt=0,48&hl=en&num=20",11307352277925509147,4.0,"https://scholar.google.com/scholar?cluster=11307352277925509147&hl=en&num=20&as_sdt=0,48&as_vis=1",11307352277925509147,PDF,osti.gov,https://www.osti.gov/servlets/purl/1604756
1,2,,AI-based campus energy use prediction for assessing the effects of climate change,https://www.mdpi.com/692550,1F1cCFsvrVYJ,"S Fathi, RS Srinivasan, CJ Kibert, RL Steiner… - Sustainability, 2020 - mdpi.com","… understanding of their future energy needs, and to plan … energy use prediction tool for predicting the effects of long-term climate change on the energy performance of buildings using AI …",18.0,"https://scholar.google.com/scholar?cites=6245700326261546452&as_sdt=5,48&sciodt=0,48&hl=en&num=20",6245700326261546452,6.0,"https://scholar.google.com/scholar?cluster=6245700326261546452&hl=en&num=20&as_sdt=0,48&as_vis=1",6245700326261546452,PDF,mdpi.com,https://www.mdpi.com/2071-1050/12/8/3223/pdf
1,3,,Eco2AI: carbon emissions tracking of machine learning models as the first step towards sustainable AI,https://arxiv.org/abs/2208.00406,hZ_GQ94q6FwJ,"S Budennyy, V Lazarev, N Zakharenko… - arXiv preprint arXiv …, 2022 - arxiv.org","… The ecological impact of AI is a major concern … AI models built to be environmentally sustainable, to be optimized not only in term of accuracy of prediction, but also in terms of energy …",14.0,"https://scholar.google.com/scholar?cites=6694647980194439045&as_sdt=5,48&sciodt=0,48&hl=en&num=20",6694647980194439045,5.0,"https://scholar.google.com/scholar?cluster=6694647980194439045&hl=en&num=20&as_sdt=0,48&as_vis=1",6694647980194439045,PDF,arxiv.org,https://arxiv.org/pdf/2208.00406
1,4,,When ai difficulty is easy: The explanatory power of predicting irt difficulty,https://ojs.aaai.org/index.php/AAAI/article/view/20739,rDIgGbrK8UMJ,"F Martínez-Plumed, D Castellano… - Proceedings of the …, 2022 - ojs.aaai.org","… phenomena, and the wider areas of AI evaluation and explainable AI, have to do with the … instance difficulty for a wide range of AI domains covering several areas, from supervised …",6.0,"https://scholar.google.com/scholar?cites=4895917170562708140&as_sdt=5,48&sciodt=0,48&hl=en&num=20",4895917170562708140,4.0,"https://scholar.google.com/scholar?cluster=4895917170562708140&hl=en&num=20&as_sdt=0,48&as_vis=1",4895917170562708140,PDF,aaai.org,https://ojs.aaai.org/index.php/AAAI/article/view/20739/20498
1,5,,Energy Efficiency through the Implementation of an AI Model to Predict Room Occupancy Based on Thermal Comfort Parameters,https://www.mdpi.com/2071-1050/14/13/7734,nvUBLmfpLGYJ,"SA Abdel-Razek, HS Marie, A Alshehri, OM Elzeki - Sustainability, 2022 - mdpi.com","… explainability, challenges such as power savings, traffic control… energy efficiency is an unsolved research problem with several integrated research problems. Using AI to improve energy …",14.0,"https://scholar.google.com/scholar?cites=7362516120206701982&as_sdt=5,48&sciodt=0,48&hl=en&num=20",7362516120206701982,8.0,"https://scholar.google.com/scholar?cluster=7362516120206701982&hl=en&num=20&as_sdt=0,48&as_vis=1",7362516120206701982,PDF,mdpi.com,https://www.mdpi.com/2071-1050/14/13/7734/pdf
1,6,,… ‐based intelligent GEP and ANFIS models in prediction of thermophysical properties of Fe3O4‐coated MWCNT hybrid nanofluids for potential application in energy …,https://onlinelibrary.wiley.com/doi/abs/10.1002/er.8010,7ac9lrSU1X8J,"P Sharma, Z Said, S Memon… - … Journal of Energy …, 2022 - Wiley Online Library","… power, along with the introduction of powerful AI & ML approaches for regression and model prediction, 20, 21 has enabled reliable prediction of … AI-based approaches are proven to be …",35.0,"https://scholar.google.com/scholar?cites=9211432116191864813&as_sdt=5,48&sciodt=0,48&hl=en&num=20",9211432116191864813,3.0,"https://scholar.google.com/scholar?cluster=9211432116191864813&hl=en&num=20&as_sdt=0,48&as_vis=1",9211432116191864813,PDF,hud.ac.uk,https://pure.hud.ac.uk/ws/files/48665622/Accepted_manuscript.pdf
1,7,,Advanced AI-based techniques to predict daily energy consumption: A case study,https://www.sciencedirect.com/science/article/pii/S0957417421009180,DoRJjgo_idcJ,"A Baba - Expert Systems with Applications, 2021 - Elsevier",… techniques used to predict the daily power consumption for a … that contains the consumed power for the same regarded … to predict the consumed power by using probabilistic and AI-…,9.0,"https://scholar.google.com/scholar?cites=15531014104533271566&as_sdt=5,48&sciodt=0,48&hl=en&num=20",15531014104533271566,2.0,"https://scholar.google.com/scholar?cluster=15531014104533271566&hl=en&num=20&as_sdt=0,48&as_vis=1",15531014104533271566,,,
1,8,,PEFS: AI-driven prediction based energy-aware fault-tolerant scheduling scheme for cloud data center,https://ieeexplore.ieee.org/abstract/document/9165232/,LDlgDu3GjiAJ,"A Marahatta, Q Xin, C Chi, F Zhang… - IEEE Transactions on …, 2020 - ieeexplore.ieee.org","… energy consumption. To reduce task execution failure as well as energy consumption, we propose a novel AI-driven energy-… First, a prediction model based on the machine learning …",28.0,"https://scholar.google.com/scholar?cites=2346031177357343020&as_sdt=5,48&sciodt=0,48&hl=en&num=20",2346031177357343020,4.0,"https://scholar.google.com/scholar?cluster=2346031177357343020&hl=en&num=20&as_sdt=0,48&as_vis=1",2346031177357343020,PDF,researchgate.net,https://www.researchgate.net/profile/Avinab-Marahatta/publication/343590659_PEFS_AI-driven_Prediction_based_Energy-aware_Fault-tolerant_Scheduling_Scheme_for_Cloud_Data_Center/links/608e98fd458515d315ee7a72/PEFS-AI-driven-Prediction-based-Energy-aware-Fault-tolerant-Scheduling-Scheme-for-Cloud-Data-Center.pdf?_sg%5B0%5D=started_experiment_milestone&origin=journalDetail&_rtd=e30%3D
1,9,Html,Rapidly predicting Kohn–Sham total energy using data-centric AI,https://www.nature.com/articles/s41598-022-18366-7,_ZmFgjqqLMMJ,"H Kurban, M Kurban, MM Dalkilic - Scientific Reports, 2022 - nature.com",… The focus of this work is to leverage AI to improve upon the … iterative procedure minimizing total energy while pairs of electron … While there is a considerable growing demand to predict …,1.0,"https://scholar.google.com/scholar?cites=14063802904645835261&as_sdt=5,48&sciodt=0,48&hl=en&num=20",14063802904645835261,8.0,"https://scholar.google.com/scholar?cluster=14063802904645835261&hl=en&num=20&as_sdt=0,48&as_vis=1",14063802904645835261,HTML,nature.com,https://www.nature.com/articles/s41598-022-18366-7
1,10,,Dual-objective optimization for energy-saving and fouling mitigation in MBR plants using AI-based influent prediction and an integrated biological-physical model,https://www.sciencedirect.com/science/article/pii/S0376738821001587,Zucpe0bptVQJ,"KJ Nam, SK Heo, GH Rhee, MJ Kim, CK Yoo - Journal of Membrane …, 2021 - Elsevier","… Thus, the hourly influent prediction model continuously predicts influent conditions after 24 … influent prediction to overcome the weak prediction performances of conventional prediction …",15.0,"https://scholar.google.com/scholar?cites=6104041358893901670&as_sdt=5,48&sciodt=0,48&hl=en&num=20",6104041358893901670,3.0,"https://scholar.google.com/scholar?cluster=6104041358893901670&hl=en&num=20&as_sdt=0,48&as_vis=1",6104041358893901670,,,
1,11,,"Power efficient video super-resolution on mobile npus with deep learning, mobile ai & aim 2022 challenge: Report",https://arxiv.org/abs/2211.05256,JlY8-jYZqd0J,"A Ignatov, R Timofte, CM Chiang, HK Kuo… - arXiv preprint arXiv …, 2022 - arxiv.org","… low FPS rates and power efficiency on mobile devices. In this Mobile AI challenge, we … for mobile NPUs optimized for low energy consumption. The participants were provided with …",4.0,"https://scholar.google.com/scholar?cites=15972325277363361318&as_sdt=5,48&sciodt=0,48&hl=en&num=20",15972325277363361318,2.0,"https://scholar.google.com/scholar?cluster=15972325277363361318&hl=en&num=20&as_sdt=0,48&as_vis=1",15972325277363361318,PDF,arxiv.org,https://arxiv.org/pdf/2211.05256
1,12,,AI for audience prediction and profiling to power innovative TV content recommendation services,https://dl.acm.org/doi/abs/10.1145/3347449.3357485,InjC-9yHbH4J,"L Nixon, K Ciesielski, B Philipp - … of the 1st International Workshop on AI …, 2019 - dl.acm.org",… TV audience prediction. We show how this can improve the accuracy of the audience prediction. … with AI-enabled audience profiling to power new content recommendation services. …,9.0,"https://scholar.google.com/scholar?cites=9109805529450051618&as_sdt=5,48&sciodt=0,48&hl=en&num=20",9109805529450051618,2.0,"https://scholar.google.com/scholar?cluster=9109805529450051618&hl=en&num=20&as_sdt=0,48&as_vis=1",9109805529450051618,PDF,core.ac.uk,https://core.ac.uk/download/pdf/228238678.pdf
1,13,,Raodat: An energy-efficient reconfigurable ai-based object detection and tracking processor with online learning,https://ieeexplore.ieee.org/abstract/document/9634785/,GR9WAncWZtkJ,"Y Gong, Q Liu, L Que, C Jia, J Huang… - 2021 IEEE Asian …, 2021 - ieeexplore.ieee.org","… , the tracking with online learning is also enabled to track each … and power consumption for the face search & tracking task … The execution time for the detection, recognition and tracking …",3.0,"https://scholar.google.com/scholar?cites=15665233054250966809&as_sdt=5,48&sciodt=0,48&hl=en&num=20",15665233054250966809,,{},{},,,
1,14,Pdf,Campus energy use prediction (CEUP) using artificial intelligence (AI) to study climate change impacts,http://www.ibpsa.org/proceedings/BS2019/BS2019_210874.pdf,JSs9kK8LTLMJ,"S Fathi, R Srinivasan, R Ries - Proceedings of the 2019 Building …, 2019 - ibpsa.org","… cause significant changes in energy use patterns. … AI-based forecasting tool, Campus Energy Use Prediction (CEUP) that can help managers to forecast campus future monthly energy …",8.0,"https://scholar.google.com/scholar?cites=12919714279686220581&as_sdt=5,48&sciodt=0,48&hl=en&num=20",12919714279686220581,,{},{},PDF,ibpsa.org,http://www.ibpsa.org/proceedings/BS2019/BS2019_210874.pdf
1,15,,"Boost AI power: Data augmentation strategies with unlabeled data and conformal prediction, a case in alternative herbal medicine discrimination with electronic nose",https://ieeexplore.ieee.org/abstract/document/9505688/,oUA0RzyRXIAJ,"L Liu, X Zhan, R Wu, X Guan, Z Wang… - IEEE Sensors …, 2021 - ieeexplore.ieee.org","… The five augmentation strategies, namely noise-adding data augmentation, semi-supervised learning, classifier-based online learning, Inductive Conformal Prediction (ICP) online …",13.0,"https://scholar.google.com/scholar?cites=9249427422790828193&as_sdt=5,48&sciodt=0,48&hl=en&num=20",9249427422790828193,3.0,"https://scholar.google.com/scholar?cluster=9249427422790828193&hl=en&num=20&as_sdt=0,48&as_vis=1",9249427422790828193,PDF,arxiv.org,https://arxiv.org/pdf/2102.03088
1,16,,Predicting the bandgap energy of distorted GaSbxAs1-x and InSbxAs1-x using design of experiment (DoE) and artificial intelligence (AI): A comparative study,https://www.sciencedirect.com/science/article/pii/S0022369722005972,YySXrlOy1AwJ,"A Tarbi, T Chtouki, MA Sellam, Y Elkouari… - Journal of Physics and …, 2023 - Elsevier","… prediction, we studied the effects of the strain on the materials. The E ghh and E glh energy … to their BAC and RSM counterparts, and the energy range narrows with increasing Sb(x) …",3.0,"https://scholar.google.com/scholar?cites=924559895998964835&as_sdt=5,48&sciodt=0,48&hl=en&num=20",924559895998964835,,{},{},,,
1,17,,ρReveal: An AI-based Big Data Analytics Scheme for Energy Price Prediction and Load Reduction,https://ieeexplore.ieee.org/abstract/document/9377144/,svvE4qPAUXsJ,"A Kumari, S Tanwar - … on Cloud Computing, Data Science & …, 2021 - ieeexplore.ieee.org","… Energy price plays crucial role in load control and energy management at SG. In this paper, … proposed to predict energy prices based on AI and BDA for optimised energy management. …",3.0,"https://scholar.google.com/scholar?cites=8886095349895461810&as_sdt=5,48&sciodt=0,48&hl=en&num=20",8886095349895461810,,{},{},,,
1,18,Html,Deakin microgrid digital twin and analysis of AI models for power generation prediction,https://www.sciencedirect.com/science/article/pii/S2590174523000260,P9k7GSTu1bAJ,"I Natgunanathan, V Mak-Hau, S Rajasegarar… - Energy Conversion and …, 2023 - Elsevier","… In the rest of the paper, we focus our analysis on one of the important aspects of the DMDT; the prediction of generated power from the Deakin solar farm using AI models. …",,{},{},2.0,"https://scholar.google.com/scholar?cluster=12742352559524272447&hl=en&num=20&as_sdt=0,48&as_vis=1",12742352559524272447,HTML,sciencedirect.com,https://www.sciencedirect.com/science/article/pii/S2590174523000260
1,19,,The fundamental research on AI prediction and determination of control force for maximizing the power generation of PA-WEC in irregular waves,https://asmedigitalcollection.asme.org/OMAE/proceedings-abstract/OMAE2021/V005T05A010/1121395,Lgqt9t5EVhgJ,"M Murai, S Sakamoto - International Conference on …, 2021 - asmedigitalcollection.asme.org","… or certainty of the efficient prediction. In this paper, we examine the possibility of applying AI to predict and decide the control force for maximizing the power generation of the PA-WEC …",2.0,"https://scholar.google.com/scholar?cites=1753664829319350830&as_sdt=5,48&sciodt=0,48&hl=en&num=20",1753664829319350830,2.0,"https://scholar.google.com/scholar?cluster=1753664829319350830&hl=en&num=20&as_sdt=0,48&as_vis=1",1753664829319350830,,,
1,20,,An Energy-Efficient Reconfigurable AI-Based Object Detection and Tracking Processor Supporting Online Object Learning,https://ieeexplore.ieee.org/abstract/document/9745082/,otkM54lnZI4J,"Y Gong, T Zhang, H Guo, Q Liu, L Que… - IEEE Solid-State …, 2022 - ieeexplore.ieee.org","… is needed for the detection & tracking. To address the above challenges, in this work, an energyefficient reconfigurable AI-based object detection and tracking processor (named as …",,{},{},,{},{},,,
2,1,,Low-power distributed AI and IoT for measuring Lamb's milk ingestion and predicting meat yield and malnutrition diseases,https://link.springer.com/chapter/10.1007/978-3-030-58356-9_26,QTJKguYKkPAJ,"RS Alonso - Ambient Intelligence–Software and Applications: 11th …, 2021 - Springer",… -power Distributed AI device combining IoT and Machine Learning aimed at measuring each lamb’s milk ingestion and predicting … This device will consist of a Customized Low-Energy …,3.0,"https://scholar.google.com/scholar?cites=17334366950893695553&as_sdt=5,48&sciodt=0,48&hl=en&num=20",17334366950893695553,,{},{},,,
2,2,Pdf,FUTURE OF AI IN ENERGY PREDICTION,"https://ciir.in/doc/publication/Agriculture,%20Environment%20and%20Energy%20Sustainability_978-81-962236-2-5.pdf#page=31",bOjxZSpIg6gJ,"LK Jisha - AGRICULTURE, ENVIRONMENT AND ENERGY …, 2023 - ciir.in","… order, is used to predict future events using observational data. In … power production based on meteorological data. We can predict what the potential power output of renewable energy …",,{},{},,{},{},PDF,ciir.in,"https://ciir.in/doc/publication/Agriculture,%20Environment%20and%20Energy%20Sustainability_978-81-962236-2-5.pdf#page=31"
2,3,,Explainable AI for predicting daily household energy usages,https://ieeexplore.ieee.org/abstract/document/10060217/,xLclnholmTAJ,"PK Mohanty, DS Roy… - … Conference on Artificial …, 2022 - ieeexplore.ieee.org",… for optimization of this energy. Hence predicting this household energy with the advancement of AI and Machine … But only predicting the energy consumption will not solve the problem of …,,{},{},,{},{},,,
2,4,,Analysis of AI Techniques for Maximum Power Point Tracking Under Partial Shading Conditions,https://ieeexplore.ieee.org/abstract/document/9342154/,CacYoEPzrlcJ,"S Chaudhary, A Singh - 2020 IEEE 17th India Council …, 2020 - ieeexplore.ieee.org",… AI techniques emerge out to be an alternative to the existing MPP techniques under these non-linear and complex scenarios. A comparative analysis of MPP tracking using AI … to AI …,2.0,"https://scholar.google.com/scholar?cites=6318254799021713161&as_sdt=5,48&sciodt=0,48&hl=en&num=20",6318254799021713161,,{},{},,,
2,5,,"Hyperparameter optimization, quantum-assisted model performance prediction, and benchmarking of AI-based High Energy Physics workloads using HPC",https://arxiv.org/abs/2303.15053,6bZoVm4_dSQJ,"E Wulff, M Girone, D Southwick, JPG Amboage… - arXiv preprint arXiv …, 2023 - arxiv.org",… ) of deep learning-based AI models are often compute resource … of using model performance prediction to aid the HPO … of a containerized benchmark based on an AI-model for collision …,,{},{},2.0,"https://scholar.google.com/scholar?cluster=2627075700769208041&hl=en&num=20&as_sdt=0,48&as_vis=1",2627075700769208041,PDF,arxiv.org,https://arxiv.org/pdf/2303.15053
2,6,,How marketers can use the power of an AI/ML model to identify and predict customers,https://www.ingentaconnect.com/content/hsp/ama/2022/00000008/00000002/art00002,eK0Yf9Q0HqMJ,"S Bellamkonda - Applied Marketing Analytics, 2022 - ingentaconnect.com","… input on their com pany ’ s read i ness, and on their best prac tices, for apply ing AI to an area of busi ness that takes up sig nificant time, energy and invest ment: the cre a tive pro cess. …",,{},{},4.0,"https://scholar.google.com/scholar?cluster=11753890164753608056&hl=en&num=20&as_sdt=0,48&as_vis=1",11753890164753608056,,,
2,7,,Development of AI Algorithm for Power Load Prediction of Refrigeration Compressors for Fish Storage Warehouses,https://www.ksesjournal.co.kr/articles/article/gqzE/,3ZYP4k6LY58J,"ILJ Yoo, IS Cha, YS Kang - Journal of the Korean Solar Energy …, 2021 - ksesjournal.co.kr","… on energy saving is being conducted in various fields. In this paper, a prediction algorithm is … area using deep learning, a type of AI algorithm that has recently attracted attention, as a …",1.0,"https://scholar.google.com/scholar?cites=11485176645641279197&as_sdt=5,48&sciodt=0,48&hl=en&num=20",11485176645641279197,,{},{},PDF,ksesjournal.co.kr,https://www.ksesjournal.co.kr/articles/pdf/gqzE/kses-2021-041-03-14.pdf
2,8,,A Fundamental Study on the Potential of AI Prediction in Control Force Estimation to Maximize Power Generation of PA-WECs in Irregular Waves,https://trid.trb.org/view/2018643,0ZVqVxpA-n4J,"M Murai, S Sakamoto - Journal of the Japan Society of Naval Architects …, 2022 - trid.trb.org",… presented for the maximum expected value of power generation and its control in regular … of applying AI to predict and determine the control power to maximize the power generation of …,,{},{},,{},{},,,
2,9,,Final Scientific/Technical Report: AI-Enabled Robots for Automated Nondestructive Evaluation and Repair of Power Plant Boilers,https://www.osti.gov/biblio/1875707,U0j4aCxVtJgJ,"H Zhang, A Petruska, Z Yu, Y Deng, S Liu, L Udpa - 2022 - osti.gov","… perform live repair, and uses AI for intelligent data fusion and … The robot is also powered by AI to automate data gathering (… and repair tools for robots, AI capabilities for smart autonomy, …",,{},{},,{},{},PDF,osti.gov,https://www.osti.gov/servlets/purl/1875707
2,10,,Harnessing the Power of AI to Predict the Next Pandemic Can AI predict the next pandemic?,https://levelup.gitconnected.com/harnessing-the-power-of-ai-to-predict-the-next-pandemic-37784c121d0a,s6kIilDo52sJ,P Saxena - levelup.gitconnected.com,"… Three, using AI-enabled supercomputing networks further … Therefore, using the power of AI and big analytics, we could … certain that we immediately turn to AI, for humans' collective …",,{},{},,{},{},,,
2,11,,A comparative study of classical static and AI models predicting energy consumption in machining for Learning Factories,https://pureportal.coventry.ac.uk/en/publications/a-comparative-study-of-classical-static-and-ai-models-predicting-,4blADLaAB3cJ,"LC Moreira - 10th Conference on Learning Factories, 2020 - pureportal.coventry.ac.uk","… Hence, acquiring robust and accurate energy predictive models is … (AI) techniques to form up those models. Thus, this paper carries out a comparative study of regression and AI energy …",,{},{},,{},{},,,
2,12,,AI-based descriptor for predicting alloy formation energy,http://just-cn.ustc.edu.cn/EN/abstract/abstract879.shtml,hShXmrWB4nIJ,"LI Jiancong, W Tairan, SHU Wu… - Journal of University …, 2020 - just-cn.ustc.edu.cn","… alloy formation energy descriptor of the AB2 alloy formation energy database … prediction error lower than 8.10kJ·mol-1 and a better physical interpretation. Finally, the formation energy …",,{},{},,{},{},,,
2,13,Pdf,Deliverable D5. 3 Final report on AI-driven MonB5G energy efficiency techniques,https://www.monb5g.eu/wp-content/uploads/2022/10/MonB5G_D5.3_submitted.pdf,IH1UQGL9mf8J,"LB CTTC, L Blanco, H Chergui - 2019 - monb5g.eu","… several energy-aware decentralized sustainable artificial intelligence (AI) techniques to achieve MonB5G energy… They rely on a key design principle, wherein the energy cost for running …",,{},{},,{},{},PDF,monb5g.eu,https://www.monb5g.eu/wp-content/uploads/2022/10/MonB5G_D5.3_submitted.pdf
2,14,Pdf,Feasibility study on AI-based prediction for CRUD induced power shift in PWRs,https://journal-home.s3.ap-northeast-2.amazonaws.com/site/kns2021fall/presentation/21A-331.pdf,sZpOcXCxvTcJ,"H Kim, Y Jo, D Lee - fuel [kg], 2021 - journal-home.s3.ap-northeast-2 …","… train a ML model to predict CIPS. The feasibility of the AI-based CIPS prediction method is … In this study, feasibility of AI-based CIPS prediction method has been assessed. Simulation-…",1.0,"https://scholar.google.com/scholar?cites=4016561539179780785&as_sdt=5,48&sciodt=0,48&hl=en&num=20",4016561539179780785,3.0,"https://scholar.google.com/scholar?cluster=4016561539179780785&hl=en&num=20&as_sdt=0,48&as_vis=1",4016561539179780785,PDF,amazonaws.com,https://journal-home.s3.ap-northeast-2.amazonaws.com/site/kns2021fall/presentation/21A-331.pdf
2,15,,Functional specifications for AI software tools for electric power applications. Final report,https://www.osti.gov/biblio/5463284,V4jojSBW2rUJ,WS Faught - 1985 - osti.gov,"… Like most others, however, the electric power industry lacks the personnel - knowledge … AI programming demands. Conversely, very few AI specialists are conversant with electric power …",,{},{},,{},{},,,
2,16,,"… Atomic Energy, the State Scientific Center of Russian Federation, AI Leipunsky Institute for Physics and Power Engineering, Nuclear Physics Department annual report …",https://inis.iaea.org/search/search.aspx?orig_q=RN:30054423,F09Wc6A8qrQJ,BD Kuzminov - 1998 - inis.iaea.org,"… of the nuclear track membranes, manufactured by fission fragments irradiation of polymeric film in nuclear reactor BR-10. The industrial production of polymer track membranes was …",,{},{},2.0,"https://scholar.google.com/scholar?cluster=13018284332695310103&hl=en&num=20&as_sdt=0,48&as_vis=1",13018284332695310103,PDF,iaea.org,https://inis.iaea.org/collection/NCLCollectionStore/_Public/30/054/30054423.pdf
2,17,,"arXiv: Hyperparameter optimization, quantum-assisted model performance prediction, and benchmarking of AI-based High Energy Physics workloads using HPC",https://cds.cern.ch/record/2859790,y2N9KaHfoUsJ,"E Wulff, M Girone, E Cuba, JPG Amboage, D Southwick - 2023 - cds.cern.ch",… ) of deep learning-based AI models are often compute resource … of using model performance prediction to aid the HPO … of a containerized benchmark based on an AI-model for collision …,,{},{},,{},{},PDF,cern.ch,https://cds.cern.ch/record/2859790/files/2303.15053.pdf
2,18,,"… Environmental Impact Statement Related to Reclamation of the Uranium Mill Tailings at the Atlas Site, Moab, Utah. Main Report, Appendices AI. Volume 1. Source …",https://hero.epa.gov/hero/index.cfm/reference/details/reference_id/3791172,po95X3u_asAJ,"TJ Blasing, SM Chin, CE Easterly, MH Fliegel… - 1999 - hero.epa.gov","This Final Environment Impact Statement (FESI) has been prepared by the Nuclear Regulatory Commission (NRC), Office of Nuclear Material Safety and Safeguards, to address …",,{},{},,{},{},,,
